source,target,score,source_url,target_url
"At around ten o’clock, the sirens started to go off. Alert. The Blockälteste gathered us inside the blocks, while the SS took refuge in the shelters. As it was relatively easy to escape during an alert—the guards left the watchtowers and the electric current in the barbed wire was cut—the standing order to the SS was to shoot anyone found outside his block.",ཆུ་ཚོད་བཅུ་པ་ཙམ་ཐོག་མཁའ་ལམ་གྱི་གཏོར་རྒོལ་ཡོང་བའི་ཉེན་བརྡ་གྲག གསང་ལས་པ་ཚོས་ཉེན་ཡོལ་བྱེད་པའི་སྐབས། བཙོན་ཤག་གི་འགོ་བ་རྣམས་རྒྱུགས་ཡོང་ནས་ང་ཚོ་བཙོན་ཤག་ཏུ་འཛོམས་བཅུག ཉེན་བརྡ་ཞིག་གྲག་སྐབས་སུ་ཅུང་ཙམ་བཙོན་འབྲོས་ལ་སྟབས་བདེ་ – སྲུང་དམག་རྣམས་སོ་ལྟའི་སྟེགས་བུ་དང་བྲལ་བ་དང་། གཟེ་མ་རྭ་མགོའི་གློག་ལམ་བཅད་ཡོད་སྟབས། གསང་ལས་པས་བཙོན་ཤག་གི་ཕྱི་ལོགས་སུ་མཐོང་ཚད་གསོད་ཆོག་པའི་བཀའ་བཏང་ཡོད།,0.850503,NA,https://latse.org/108-translations/#Night
"In no time, the camp had the look of an abandoned ship. No living soul in the alleys. Next to the kitchen, two cauldrons of hot, steaming soup had been left untended. Two cauldrons of soup! Smack in the middle of the road, two cauldrons of soup with no one to guard them! A royal feast going to waste! Supreme temptation! Hundreds of eyes were looking at them, shining with desire. Two lambs with hundreds of wolves lying in wait for them. Two lambs without a shepherd, free for the taking. But who would dare?",དུས་ཡུན་སྐར་མ་ཁ་ཤས་ནང་། བཙོན་སྒར་དེ་བདག་མེད་དུ་དོར་བའི་གྲུ་གཟིངས་ཤིག་དང་མཚུངས། འགྲོ་ལམ་དག་ཏུ་སྲོག་དབང་ཅན་ཞིག་མཐོང་རྒྱུ་མེད་པར་གྱུར། ཐབ་ཚང་དང་ཉེ་སར་རླངས་པ་འཐུལ་བའི་ཁུ་ཐང་གི་སླ་ང་ཆེན་པོ་གཉིས་བདག་མེད་དུ་ལུས་ཡོད། ཁུ་ཐང་གི་སླ་ང་ཆེན་པོ་གཉིས་འདུག ཁུ་ཐང་གི་སླ་ང་ཆེན་པོ་གཉིས་པོ་དེ་སྲུང་མཁན་གཅིག་ཀྱང་མེད་པར་ལམ་ཕྲན་དཀྱིལ་དུ་ཡོད། དེ་ནི་ཡིད་ཀྱི་བརྟན་པ་འཕྲོག་ཅིང་བདག་མེད་དུ་ལུས་པའི་རྒྱལ་པོའི་གསོལ་སྟོན་ཞིག་མིན་ནམ། མིག་དབང་བརྒྱ་ཕྲག་དེ་ལ་གཏད་ཅིང་འདོད་སྲེད་ཀྱི་འོད་སྣང་འཚེར། ལུག་གཉིས་ལ་སྤྱང་ཀི་བརྒྱ་ཕྲག་གིས་རྔམ་སྒུག་བྱེད། རྫི་བོ་མེད་པའི་ལུག་ནི་གྲོག་སྐལ་ཡིན་ནའང་། སུ་ཞིག་གིས་དེ་ལེན་ཕོད་དམ།,1.00574,NA,https://latse.org/108-translations/#Night
"Fear was greater than hunger. Suddenly, we saw the door of Block 37 open slightly. A man appeared, crawling snakelike in the direction of the cauldrons.",འཇིགས་སྣང་ནི་ལྟོགས་སྡུག་ལས་ཆེ། གློ་བུར་དུ་ང་ཚོས་བཙོན་ཤག་༣༧་པའི་སྒོ་དལ་གྱིས་འབྱེད་པ་མཐོང་། སྐྱེས་བུ་ཞིག་མངོན་པར་གྱུར་ཅིང་སྲིན་འབུ་བཞིན་དུ་སླ་ང་ཆེན་པོ་གཉིས་ཀྱི་ཕྱོགས་སུ་གོག་ནུར་བྱས།,0.841406,NA,https://latse.org/108-translations/#Night
"Hundreds of eyes were watching his every move. Hundreds of men were crawling with him, scraping their bodies with his on the stones. All hearts trembled, but mostly with envy. He was the one who had dared.",མིག་དབང་བརྒྱ་ཕྲག་ཁ་ཤས་མི་དེའི་གོག་ནུར་གྱི་རྗེས་སུ་དེད། སྐྱེས་བུ་བརྒྱ་ཕྲག་ཁ་ཤས་ཀྱི་འདོད་པ་ཁོ་དང་མཉམ་དུ་གོག་འགྲོས་བྱེད་ཅིང་། ཁོ་ཚོའི་པུས་མོའི་སླ་ང་ལམ་ངོས་ཀྱི་རྡེའུ་ལ་བརྡར། མི་རེ་རེའི་སྙིང་ཁམས་འཕར་ལྡིང་བྱེད་ཅིང་ཕྲག་དོག་གིས་ཡོངས་སུ་བཟུང་། སྐྱེས་བུ་འདི་ལ་སྙིང་སྟོབས་ལྡན།,0.812406,NA,https://latse.org/108-translations/#Night
"He reached the first cauldron. Hearts were pounding harder: he had succeeded. Jealousy devoured us, consumed us. We never thought to admire him. Poor hero committing suicide for a ration or two or more of soup ... In our minds, he was already dead.",ཁོ་སླ་ང་དང་པོའི་སར་བསླེབས། ཁོའི་བསམ་དོན་གྲུབ་པར་སྙིང་ཁམས་རྣམས་འགྲན་བཞིན་དུ་ལྡིང་། ཕྲག་དོག་གིས་ང་ཚོ་ཟོས་ཤིང་ང་ཚོ་རྩྭ་སྐམ་བཞིན་དུ་བསྲེགས། ང་ཚོ་ཁོ་ལ་ཡི་རང་སྐད་ཅིག་ཙམ་ཡང་མ་སྐྱེས། ལས་ངན་གྱི་དཔའ་རྒོད། ཁུ་ཐང་ཟས་སྐལ་གཅིག་གི་དོན་དུ་རང་སྲོག་འདོར་བའི་ལས་ངན་རྩོམ་པ་ལ་ལྟོས་དང་། ང་ཚོའི་བློ་ཡུལ་དུ་ང་ཚོས་ཁོ་གསོད་བཞིན་ཡོད།,0.890218,NA,https://latse.org/108-translations/#Night
"Lying on the ground near the cauldron, he was trying to lift himself to the cauldron’s rim. Either out of weakness or out of fear, he remained there, undoubtedly to muster his strength. At last he succeeded in pulling himself up to the rim. For a second, he seemed to be looking at himself in the soup, looking for his ghostly reflection there. Then, for no apparent reason, he let out a terrible scream, a death rattle such as I had never heard before and, with open mouth, thrust his head toward the still steaming liquid. We jumped at the sound of the shot. Falling to the ground, his face stained by the soup, the man writhed a few seconds at the base of the cauldron, and then he was still.",ཁོ་སླ་ང་དེའི་འཁྲིས་སུ་བསྣར་ནས་ཡོད་ཅིང་། ད་ལྟ་ཁོའི་ལུས་པོ་ཡར་སླ་ངའི་ཁར་འདེགས་པར་བྱེད། ལུས་ཟུངས་ཟད་པ་དང་འཇིགས་སྣང་གཉིས་ཀྱི་དབང་གིས་དེར་ཅུང་ཙམ་བསྡད་དེ་མཐའ་མའི་ལུས་ཤུགས་སྐྱེད་ཀྱིན་ཡོད་པར་ཐེ་ཚོམ་མེད། ཁོའི་ལུས་ཤུགས་མཐའ་མ་སྒྲིམ་གྱིན་ཡོད་པར་ཐེ་ཚོམ་མེད། མཐར་ཐུག་ཁོས་རང་གི་གཟུགས་པོ་སླ་ངའི་ཁར་འདེགས་ཐུབ་པར་གྱུར། ཡུད་ཙམ་ཞིག་ལ་ཁོས་རང་ཉིད་ལ་ལྟ་གིན་ཡོད་དེ། ཁུ་ཐང་གི་ནང་དུ་ཤར་བའི་རང་གི་གདོན་འདྲེ་ལྟ་བུའི་གཟུགས་བྱད་འཚོལ་བཞིན་ཡོད་པ་འདྲ། དེའི་རྗེས་སུ་རྒྱུ་མཚན་ཅི་ཡང་མི་མཐོང་བར་ཁོས་སྐྱི་གཡའ་བའི་ཆོ་ངེ་ཞིག་བཏོན། དེ་འདྲའི་ཆོ་ངེ་ཞིག་ངས་གཏན་ནས་གོ་མ་མྱོང་། ཁོས་ཁ་གདངས་ཤིང་ཁོའི་མགོ་རླངས་པ་འཕྱུར་བཞིན་པའི་ཁུ་ཐང་ནང་དུ་བརྒྱབ། ང་ཚོ་མདེའུ་ཞིག་གི་འགད་སྒྲས་དཀྲོགས། སྐྱེས་བུ་དེ་ཐང་དུ་གན་རྐྱལ་དུ་འགྱེལ་ཞིང་། ཁོའི་ངོ་ཁུ་ཐང་གིས་སྦགས་འདུག ཁོས་སྐར་ཆ་འགའ་ཡི་ཡུན་ལ་སླ་ངའི་རྩར་འགྲེ་ལྡོག་བྱས་ནས་འགུལ་མེད་དུ་གྱུར།,0.904171,NA,https://latse.org/108-translations/#Night
"That was when we began to hear the planes. Almost at the same moment, the barrack began to shake.",དེ་ནས་ང་ཚོས་གནམ་གྲུའི་སྒྲ་ཐོས། དེ་དང་ཆབས་ཅིག་བཙོན་སྒར་འདར་འགོ་ཚུགས།,0.888722,NA,https://latse.org/108-translations/#Night
"“They’re bombing the Buna factory,” someone shouted.",མི་ཞིག་གིས། “ཁོ་ཚོས་བྷུ་ན་གཏོར་གྱི་འདུག” ཅེས་འུར་བརྒྱབ།,0.904559,NA,https://latse.org/108-translations/#Night
"I anxiously thought of my father, who was at work. But I was glad nevertheless. To watch that factory go up in flames—what revenge! While we had heard some talk of German military defeats on the various fronts, we were not sure if they were credible. But today, this was real!",ངའི་སེམས་སུ་ངའི་ཨ་ཕ་འཁོར། ཡིན་ནའང་གཞན་རྣམས་དང་མཚུངས་པར་ང་ལ་དགའ་སྤྲོ་སྐྱེས། འདི་དག་ཐམས་ཅད་མེ་དཔུང་གིས་བསྲེགས་པར་བྱས་ན་ཇི་འདྲའི་སྙིང་ནད་སངས་པ་ལ་ཨང་། ང་ཚོས་ཇར་མན་གྱི་དམག་དཔུང་གཡུལ་ས་མང་པོ་ན་ཕམ་པར་འགྱུར་བའི་གླེང་མོལ་མང་པོ་ཐོས་མྱོང་། འོན་ཀྱང་ང་ཚོས་དེ་ཡིད་ཆེས་སུ་འོས་པའི་ཚད་མི་ཤེས། དེ་རིང་གི་འདི་མཐོང་ཆོས་སུ་གྱུར།,1.03767,NA,https://latse.org/108-translations/#Night
"We were not afraid. And yet, if a bomb had fallen on the blocks, it would have claimed hundreds of inmates’ lives. But we no longer feared death, in any event not this particular death. Every bomb that hit filled us with joy, gave us renewed confidence.",ང་ཚོ་མ་སྐྲག འགད་རྡེལ་གཅིག་བཙོན་ཤག་གི་སྟེང་ལྷུང་བ་ཡིན་ན་དེ་གཅིག་པོས་གནས་གཅིག་ཏུ་མི་སྲོག་བརྒྱ་ཕྲག་འཁྱེར་བར་འགྱུར། ཡིན་ཡང་ང་ཚོ་འཆི་བ་ལ་མི་འཇིགས། འདི་འདྲའི་འཆི་བར་ང་ཚོ་ཅིས་ཀྱང་མི་སྐྲག འགད་རྫས་རེ་རེ་གས་ན་ང་ཚོ་སྤྲོ་བས་ཁེངས་ཤིང་མི་ཚེ་ལ་རེ་བ་གསར་བ་སྐྱེས།,0.803947,NA,https://latse.org/108-translations/#Night
"The raid lasted more than one hour. If only it could have gone on for ten times ten hours ... Then, once more, there silence. The last sound of the American plane dissipated in the wind and there we were, in our cemetery. On the horizon we saw a long trail of black smoke. The sirens began to wail again. The end of the alert.",མཁའ་ལམ་གྱི་གཏོར་རྒོལ་དུས་ཚོད་གཅིག་ལྷག་ལ་བྱས། གལ་ཏེ་འདི་ལྟར་ལྡབ་བཅུ་དང་དུས་ཚོད་བཅུ་ཙམ་ལ་གཏོར་ན་ … དེ་རྗེས་ཡང་བསྐྱར་ཁུ་སིམ་མེར་གྱུར། མཐའ་མཇུག་གི་ཨ་མེ་རི་ཀའི་གནམ་གྲུའི་སྒྲ་དེ་ལྷགས་རླུང་གིས་ཁྱེར་ཅིང་། ང་ཚོར་ང་ཚོ་བསྐྱར་དུ་དུར་སར་ལུས་པའི་ཚོར་སྣང་ཞིག་བྱུང་། དུད་སྤྲིན་ནག་པོ་ཆེན་པོ་ཞིག་སའི་མཐའ་ནས་མཁར་འཕྱུར། ཉེན་བརྡ་བསྐྱར་དུ་ཐེངས་གཅིག་གྲག དེ་ནི་ཉེན་ཁ་མཇུག་བསྒྲིལ་བའི་བརྡ་ཡིན།,0.941369,NA,https://latse.org/108-translations/#Night
"Everyone came out of the blocks. We breathed in air filled with fire and smoke, and our eyes shone with hope. A bomb had landed in the middle of the camp, near the Appelplatz, the assembly point, but had not exploded. We had to dispose of it outside was the camp.",མི་ཚང་མ་བཙོན་ཤག་གི་སྒོར་ཐོན། ང་ཚོའི་བྲང་ཁོག་མེ་དུད་ཀྱིས་གང་བའི་རླུང་དབུགས་ཀྱིས་ཁེངས་ཤིང་། ང་ཚོའི་མིག་དབང་ལས་རེ་བའི་འོད་སྣང་འཚེར། འགད་རྫས་གཅིག་བཙོན་སྒར་གྱི་དཀྱིལ་ཏེ། ཚོགས་འཛོམས་བྱེད་སའི་འཁྲིས་སུ་ཟགས་འདུག་ཀྱང་དེ་གད་མི་འདུག ང་ཚོས་དེ་བཙོན་སྒར་གྱི་ཕྱི་ལོགས་སུ་དབོར་དགོས་བྱུང་། བཙོན་སྒར་གྱི་འགོ་བ་དེ་ཁ་ཕོ་ཡི་འགོ་བ་དང་བསྡེབས་ནས་འགྲོ་ལམ་དག་ཏུ་ལྟ་རྟོག་གི་འགྲུལ་སྐྱོད་བྱེད། ཁོའི་གདོང་ལ་མཁའ་རྒོལ་ལས་བྱུང་བའི་འཇིགས་སྣང་གི་རྗེས་ཤུལ་རེ་ཤར་འདུག,0.36625,NA,https://latse.org/108-translations/#Night
"The head of the camp, the Lagerälteste, accompanied by his aide and by the chief Kapo, were on an inspection tour of the camp. The raid had left traces of great fear on his face. In the very center of the camp lay the body of the man with soup stains on his face, the only victim. The cauldrons were carried back to the kitchen.",བཙོན་སྒར་གྱི་དཀྱིལ་དུ་གདོང་པ་ཁུ་ཐང་གིས་སྦགས་པའི་བེམ་པོ་དེ་བསྣར་ནས་ཡོད་ལ། དེ་ནི་རྐྱེན་ལམ་དུ་སོང་བ་གཅིག་པོ་ཡིན། སླ་ང་དེ་གཉིས་ཕྱིར་ཐབ་ཚང་གི་ནང་དུ་ཁྱེར།,0.75999,NA,https://latse.org/108-translations/#Night
"The SS were back at their posts in the watchtowers, behind their machine guns. Intermission was over.",SS ཚོས་ཁོ་ཚོའི་སོ་ལྟ་སྟེགས་བུའི་སྟེང་གི་སྦག་སྦག་མེ་མདའི་རྒྱབ་ཏུ་སོང་། བར་སྐབས་ཀྱི་ངལ་གསོ་དེ་རེ་ཞིག་མཇུག་བསྒྲིལ།,1.05947,NA,https://latse.org/108-translations/#Night
"An hour later, we saw the Kommandos returning, in step as always. Happily, I caught sight of my father.",དུས་ཚོད་གཅིག་ཙམ་གྱི་རྗེས་ལ། ང་ཚོས་དུས་རྒྱུན་དང་འདྲ་བར་ངལ་རྩོལ་རུ་ཁག་རྣམས་གོམ་འགྲོས་གཅིག་གྱུར་གྱིས་ཕྱིར་ཡོང་གི་ཡོད་པ་མཐོང་། ངས་སྤྲོ་སྣང་གི་སྒོ་ནས་རང་གི་ཨ་ཕ་མཐོང་བར་གྱུར།,0.853953,NA,https://latse.org/108-translations/#Night
"“Several buildings were flattened,” he said, “but the depot was not touched ...”",ཁོང་ན་རེ། “ཕྱི་ལོགས་སུ་ཁང་བ་ཁ་ཤས་ལེབ་ལེབ་བཟོས་ཚར་འདུག ཡིན་ནའང་དོས་ཁང་ལ་གནོད་ཐུབ་མི་འདུག”,0.508696,NA,https://latse.org/108-translations/#Night
"In the afternoon, we cheerfully went to clear the ruins.",ཕྱི་དྲོར་ང་ཚོ་སྤྲོ་སྣང་གི་སྒོ་ནས་ཞིག་རོ་རྣམས་གཙང་མ་བྱེད་དུ་སོང་།,0.649038,NA,https://latse.org/108-translations/#Night
"One week later, as we returned from work, there, in the middle of the camp, in the Appelplatz, stood a black gallows.",བདུན་ཕྲག་གཅིག་གི་རྗེས། ང་ཚོ་ལས་ཀ་ནས་ཕྱིར་ལོག་པའི་སྐབས། བཙོན་སྒར་གྱི་དཀྱིལ་ཏེ། ཚོགས་འཛོམས་བྱེད་སར་དཔྱངས་སྒག་གི་གསོད་སྟེགས་ནག་པོ་ཞིག་བཙུགས་ཡོད་པ་མཐོང་།,1.47472,NA,https://latse.org/108-translations/#Night
"We learned that soup would be distributed only after roll call, which lasted longer than usual. The orders were given more harshly than on other days, and there were strange vibrations in the air.",ང་ཚོར་མིང་འབོད་གྲངས་བཤེར་མ་བྱས་བར་དུ་ཁུ་ཐང་བགོ་འགྲེམས་བྱེད་མི་ཆོག་པ་བཤད་ཡོད། འདི་ནི་དུས་རྒྱུན་དང་མི་འདྲ་བར་དུས་ཡུན་རིང་བོ་འགོར། བཀའ་ཚིག་དག་ཉིན་གཞན་པ་དག་ལས་རྣོ་ཞིང་རྩུབ། མཁའ་རླུང་ནང་དུ་བཤད་མི་ཤེས་པའི་ཚོར་སྣང་ཞིག་འདུག,0.968621,NA,https://latse.org/108-translations/#Night
“Caps off!” the Lagerälteste suddenly shouted.,“ཞྭ་མོ་ཕུད།” བཙོན་སྒར་གྱི་འགོ་བས་གློ་བུར་དེ་ལྟར་བསྒྲགས།,1.0039,NA,https://latse.org/108-translations/#Night
Ten thousand caps came off at once.,ཞྭ་མོ་ཁྲི་ཕྲག་དུས་གཅིག་ལ་ཕུད།,0.665,NA,https://latse.org/108-translations/#Night
“Cover your heads!”,“ཞྭ་མོ་གོན་ཞིག”,0.282353,NA,https://latse.org/108-translations/#Night
"Ten thousand caps were back on our heads, at lightning speed.",ཞྭ་མོ་ཁྲི་ཕྲག་ཕྱིར་ཀླད་པའི་སྟེང་དུ་བཀབ། དེ་ལྟར་བྱེད་པ་གློག་འཁྱུག་པ་ལྟར་མགྱོགས།,1.00714,NA,https://latse.org/108-translations/#Night
The camp gate opened. An SS unit appeared and encircled us: one SS every three paces. The machine guns on the watchtowers were pointed toward the Appelplatz.,བཙོན་སྒར་གྱི་རྒྱ་སྒོ་ཕྱེ་སོང་། SS ཡི་སྡེ་ཚན་ཞིག་ཡོང་ནས་ང་ཚོའི་མཐའ་བསྐོར། གོམ་པ་གསུམ་རེའི་མཚམས་ན་ SS རེ་ཡོད། སོ་ལྟ་སྟེགས་བུ་དག་ན་སྦག་སྦག་མེ་མདའ་རྣམས་ཚོགས་འཛོམས་བྱེད་སར་གཏད་ཡོད།,1.1375,NA,https://latse.org/108-translations/#Night
"“They’re expecting trouble,” whispered Juliek.",ཇུ་ལི་ཡེག་ཡིས་“ཁོ་ཚོ་རྙོག་ཟིང་ཡོང་བར་འཇིགས།” ཞེས་ཤུབ་སྨྲ་བྱས།,1.16047,NA,https://latse.org/108-translations/#Night
"Two SS were headed toward the solitary confinement cell. They came back, the condemned man between them. He was a young boy from Warsaw. An inmate with three years in concentration camps behind him. He was tall and strong, a giant compared to me.",SS གཉིས་བཙོན་མ་ཁེར་འཇུག་བྱེད་སའི་ཁང་མིག་དག་གི་ཕྱོགས་སུ་སོང་། ཁོ་ཚོ་ཚུར་ཡོང་སྐབས་ཁོ་གཉིས་གྱི་བར་ན་སྲོག་ཁྲིམས་ལ་བབ་པའི་སྐྱེས་པ་ཞིག་ཁྲིད་འདུག ཁོ་ནི་ཕོ་གཞོན་ཝར་སོ་ནས་ཡོང་བ་ཞིག་ཡིན། ཁོས་བཙོན་སྒར་དུ་ལོ་གསུམ་བསྐྱལ། ང་དང་བསྡུར་ན་ཁོ་གཟུགས་པོ་ཆེ་ཞིང་ལུས་སྟོབས་དང་ལྡན་པ་ཞིག་ཡིན།,0.952941,NA,https://latse.org/108-translations/#Night
"His back was to the gallows, his face turned toward his judge, the head of the camp. He was pale but seemed more solemn than frightened. His manacled hands did not tremble. His eyes were coolly assessing the hundreds of SS guards, the thousands of prisoners surrounding him.",ཁོའི་ལུས་རྒྱབ་དཔྱངས་གསོད་སྟེགས་བུར་གཏད་ཡོད་ཅིང་། ཁོའི་ངོ་གདོང་ཁྲིམས་དཔོན་ཏེ། བཙོན་སྒར་འགོ་བར་འཁོར་འདུག་པ་དང་། གདོང་མདོག་སྐྱ་བོར་གྱུར་འདུག ཡིན་ཡང་ཁོ་འཇིགས་སྣང་གིས་བཟུང་མི་འདུག ལྕགས་སྒྲོག་གིས་བཅིངས་པའི་ཁོའི་ལག་ཟུང་འདར་གྱི་མི་འདུག ཁོའི་མིག་ཟུང་གི་བརྩེ་བྲལ་མདངས་ཀྱིས་ SS བརྒྱ་ཕྲག་ལ་ལྟ། བཙོན་མ་སྟོང་ཕྲག་ཁ་ཤས་ཀྱིས་ཁོའི་མཐའ་བསྐོར་ཡོད།,0.909211,NA,https://latse.org/108-translations/#Night
"The Lagerälteste began to read the verdict, emphasizing every word:",བཙོན་སྒར་འགོ་བས་ཁོའི་ཁྲིམས་ཆད་ཀློག་འགོ་བརྩམས་ཤིང་ཁྲིམས་ཚིག་གསལ་བསྒྲགས་བྱས།,0.429074,NA,https://latse.org/108-translations/#Night
“In the name of Reichsführer Himmler ... prisoner number ... stole during the air raid ... according to the law ... prisoner number ... is condemned to death. Let this be a warning and an example to all prisoners.”,“མིང་ལ་ཧིམ་ལར་ཟེར་ … བཙོན་མའི་ཨང་གྲངས་ … ཉེན་བརྡ་གྲག་པའི་སྐབས་སུ་རྐུན་ལས་བྱས་ … ཁྲིམས་ཀྱི་དོན་ཚན་… གཞིར་བཟུང་གིས་ … བཙོན་མའི་ཨང་གྲངས་ … སྲོག་ཁྲིམས་བཅད། འདི་ནི་བཙོན་མ་གཞན་པ་ཚང་མར་ཉེན་བརྡ་དང་མིག་ལྟོས་སུ་འགྱུར་བའི་རེ་བའང་ཡོད།”,0.562943,NA,https://latse.org/108-translations/#Night
Nobody moved.,གྲག་འགུལ་ཅི་ཡང་མེད།,0.865385,NA,https://latse.org/108-translations/#Night
