source,target,score,source_url,target_url
"The wind of revolt died down. We continued to walk until we came to a crossroads. Standing in the middle of it was, though I didn’t know it then, Dr. Mengele, the notorious Dr. Mengele. He looked like the typical SS officer: a cruel, though not unintelligent, face, complete with monocle. He was holding a conductor’s baton and was surrounded by officers. The baton was moving constantly, sometimes to the right, sometimes to the left.",གྱེན་རྒོལ་བྱེད་འདོད་ཀྱི་རླུང་ནི་འཇགས་པར་གྱུར། ང་ཚོ་མུ་མཐུད་དུ་ཐང་ར་དེར་གཤར་སྐྱོད་བྱས། ཐང་རའི་དཀྱིལ་དུ་ངན་གྲགས་ས་སྟེང་ལ་ཁྱབ་པའི་སྨན་པ་མེན་གྷེ་ལེ་(གདོང་ལ་སྙིང་རྗེའི་མདངས་ཀྱིས་ཕོངས་ཀྱང་སྤྱང་མདོག་གསལ་བ། ཡ་གཅིག་ཅན་གྱི་མིག་ཤེལ་གྱོན་པ་)ཡི་ལག་ཏུ་རོལ་དབྱངས་བཀོད་འདོམས་པའི་དབྱུ་གུ་ཞིག་ཐོགས་ཏེ་ལས་བྱེད་པ་གཞན་དག་གི་ཁྲོད་དུ་འགྲེངས་འདུག ཁོས་དབྱུ་གུ་དེ་མཚམས་མི་ཆད་པར་སྐབས་རེར་གཡས་དང་སྐབས་འགར་གཡོན་ཕྱོགས་སུ་རྐྱོང་བར་བྱེད།,0.66246,NA,https://latse.org/108-translations/#Night
"In no time, I stood before him.",ང་ཁོའི་མདུན་དུ་སླེབས་ཚར་འདུག,0.587179,NA,https://latse.org/108-translations/#Night
"“Your age?” he asked, perhaps trying to sound paternal.",ཁོས་རང་གི་སྐད་གདངས་ལ་ཕ་རྒན་གྱི་བྱམས་མདངས་ཤིག་སྟོན་ཐབས་ཀྱིས“ཁྱོད་ལོ་ན་ཅི་ཙམ་ཡིན”ཞེས་དྲིས།,0.44375,NA,https://latse.org/108-translations/#Night
“I’m eighteen.” My voice was trembling.,ངས་སྐད་འདར་བཞིན། “བཅོ་བརྒྱད།”,0.81733,NA,https://latse.org/108-translations/#Night
“In good health?”,“ཁྱོད་ཀྱི་ལུས་ཕུང་བདེ་ཐང་ཡིན་ནམ།”,0.372321,NA,https://latse.org/108-translations/#Night
“Yes.”,“ཡིན་”,0.3,NA,https://latse.org/108-translations/#Night
“Your profession?”,“ཁྱོད་ཀྱི་འཚོ་ཐབས་ཅི་ཡིན།”,0.633333,NA,https://latse.org/108-translations/#Night
Tell him that I was a student?,ངས་ང་སློབ་མ་ཞིག་ཡིན་པ་བརྗོད་དགོས་སམ།,0.501333,NA,https://latse.org/108-translations/#Night
"“Farmer,” I heard myself saying.",“སོ་ནམ་པ།” ངས་རང་གིས་འདི་སྐད་དུ་བརྗོད་པ་ཐོས།,1.34483,NA,https://latse.org/108-translations/#Night
This conversation lasted no more than a few seconds. It seemed like an eternity.,འདྲི་བཤད་ཀྱི་གཏམ་འདིར་དུས་ཡུན་སྐར་མ་འགའ་ལས་མ་འགོར་ཡང་ངའི་སྣང་ངོར་རྫོགས་མཐའ་མེད་པ་ཞིག་ཏུ་སྣང་།,0.520588,NA,https://latse.org/108-translations/#Night
"The baton pointed to the left. I took half a step forward. I first wanted to see where they would send my father. Were he to have gone to the right, I would have run after him.",དབྱུ་གུ་དེ་གཡོན་ཕྱོགས་སུ་བརྐྱངས། ང་གོམ་ཕྱེད་ཙམ་མདུན་དུ་སྤོས། ངས་མྱུར་དུ་ཁོ་ཚོས་ངའི་ཨ་ཕ་ཕྱོགས་གང་དུ་གཏོང་བ་ཤེས་ན་འདོད། གལ་སྲིད་ངའི་ཨ་ཕ་གཡས་ཕྱོགས་སུ་སོང་ན་ང་ཡང་ཁོང་གི་རྗེས་སུ་འགྲོ་རྒྱུ་རང་ཡིན།,1.03295,NA,https://latse.org/108-translations/#Night
"The baton, once more, moved to the left. A weight lifted from my heart.",ཐེངས་འདིར་ཡང་དབྱུ་གུ་དེ་གཡོན་ཕྱོགས་སུ་བརྐྱངས། ངའི་སེམས་སྟེང་ནས་རྡོག་ཁྲེས་ཤིག་ཕབ་པར་གྱུར།,0.763782,NA,https://latse.org/108-translations/#Night
"We did not know, as yet, which was the better side, right or left, which road led to prison and which to the crematoria. Still, I was happy, I was near my father. Our procession continued slowly to move forward.",ང་ཚོས་ད་དུང་ཡང་གཡས་གཡོན་གཉིས་ལས་གང་ཞིག་བཟང་བ་སྟེ། ལམ་གང་ཞིག་བཙོན་ཁང་ལ་བརྟོལ་ཡོད་པ་དང་ལམ་གང་སྲེག་ཁང་ལ་བརྟོལ་ཡོད་པ་མི་ཤེས། ཡིན་ན་ཡང་སྐབས་དེར་ངའི་སེམས་པ་བདེ་སྟེ། ང་རང་གི་ཨ་ཕའི་འཁྲིས་ན་ཡོད་པས་སོ།། ང་ཚོའི་རུ་ཕྲེང་མུ་མཐུད་དུ་མདུན་ཕྱོགས་སུ་དལ་གྱིས་འགུལ་བཞིན་ཡོད།,0.980462,NA,https://latse.org/108-translations/#Night
Another inmate came over to us:,ཡང་བསྐྱར་བཙོན་པ་ཞིག་ང་ཚོའི་འཁྲིས་ལ་ཡོང་།,0.883333,NA,https://latse.org/108-translations/#Night
“Satisfied?”,“འདོད་པ་ཚིམ་སོང་ངམ།”,0.692308,NA,https://latse.org/108-translations/#Night
"“Yes,” someone answered.",“ཚིམ་སོང་།” སུ་ཞིག་གིས་ལན་བཏབ།,1.32065,NA,https://latse.org/108-translations/#Night
"“Poor devils, you are heading for the crematorium.”",“ལས་ངན་འགོང་འདྲེ་ཁྱོད་ཚོ། ཁྱོད་ཚོ་སྲེག་ཁང་ལ་འགྲོ་བཞིན་ཡོད་པ་རེད།”,1.07641,NA,https://latse.org/108-translations/#Night
"He seemed to be telling the truth. Not far from us, flames, huge flames, were rising from a ditch. Something was being burned there. A truck drew close and unloaded its hold: small children. Babies! Yes, I did see this, with my own eyes ... children thrown into the flames. (Is it any wonder that ever since then, sleep tends to elude me?)",ཁོས་བདེན་པ་བརྗོད་པ་འདྲ། ང་ཚོ་དང་ཐག་མི་རིང་བའི་སར་མེ་འོབས་ཤིག་ལས་མེ་ལྕེ་ཧ་ཅང་ཆེན་པོ་མཆེད་བཞིན་པ་དེས་ཅི་ཞིག་སྲེག་བཞིན་འདུག དོས་འཁོར་ཆེན་པོ་ཞིག་གིས་དོས་སྤུངས་དྲུད་དེ་དེར་སོང་། དེའི་དོས་སྤུངས་ནི་བྱིས་པ་རེད་འདུག ཚང་མ་བྱིས་པ་རེད། ངས་དེ་མཐོང་སོང་། ངས་དེ་ངའི་མིག་གིས་མཐོང་ … བྱིས་པ་དེ་དག་མེ་ལྕེའི་ནང་ན་འདུག (དེའི་རྗེས་སུ་ང་གཉིད་མི་ཁུག་པ་སྐྲག་སྣང་དེས་ཡིན་ནམ། གཉིད་ཟེར་བ་དེ་ངའི་མིག་ཀོང་ལ་མ་འཁོར།),0.958004,NA,https://latse.org/108-translations/#Night
"So that was where we were going. A little farther on, there was another, larger pit for adults.",ང་ཚོ་མེ་འོབས་དེར་མངོན་དུ་ཕྱོགས་བཞིན་ཡོད། དེ་ལས་ཅུང་ཙམ་འདས་པའི་ས་ན་རྒན་པ་ཚོ་སྲེག་སའི་མེ་འོབས་ཤིག་འདུག,0.462135,NA,https://latse.org/108-translations/#Night
"I pinched myself: Was I still alive? Was I awake? How was it possible that men, women, and children were being burned and that the world kept silent? No. All this could not be real. A nightmare perhaps ... Soon I would wake up with a start, my heart pounding, and find that I was back in the room of my childhood, with my books ...",ངས་རང་གི་ལག་པས་རང་ལ་ཤ་གཅུས་བརྒྱབ། ང་གསོན་པོ་ཡིན་ནམ། ང་གཉིད་ལས་སད་ཡོད་དམ། ང་རང་གིས་མཐོང་བ་ལ་ཡིད་ཆེས་མ་ཐུབ། ཁོ་ཚོས་མི་རྒན་དང་བྱིས་པ་མེར་སྲེག་པ་དང་། འཛམ་གླིང་དོན་འདིར་དལ་འཇགས་སེར་སྡོད་ཐུབ་པ་དེ་དཔེ་སྲིད་དམ། ག་ལ་ཡིན། འདི་ནི་བདེན་པ་ཡིན་མི་སྲིད། དེ་ནི་རྨི་ལམ་ངན་པ་ཞིག་ཡིན་ལས་ཆེ། ང་མྱུར་དུ་གཉིད་ལས་སད་དགོས། ངའི་སྙིང་ལྷོག་ལྷོག་ཏུ་འཕར། ང་ནི་རང་གི་བྱིས་དུས་ཀྱི་ཉལ་ཁང་དུ་ངའི་དཔེ་དེབ་དག་གི་ཁྲོད་དུ་ཡོད་ངེས་ཡིན།,0.828263,NA,https://latse.org/108-translations/#Night
My father’s voice tore me from my daydreams:,ངའི་ཨ་ཕའི་སྐད་སྒྲས་ང་རང་ངའི་བསམ་གཞིགས་ལས་དཀྲོགས།,1.14211,NA,https://latse.org/108-translations/#Night
"“What a shame, a shame that you did not go with your mother ... I saw many children your age go with their mothers ...”",“དེ་ནི་ནོངས་འགྱོད་ཅིག་རེད། ཁྱོད་ཁྱོད་རང་གི་ཨ་མའི་མཉམ་དུ་མ་སོང་བ་དེ་ནི་ནོངས་འགྱོད་ཅིག་རེད་ … ངས་ཁྱོད་ཀྱི་ན་ཚོད་དང་མཉམ་པའི་བུ་ཁ་ཤས་ཁོ་ཚོའི་ཨ་མ་དག་གི་མཉམ་དུ་འགྲོ་བ་མཐོང་བྱུང་… .”,0.573491,NA,https://latse.org/108-translations/#Night
His voice was terribly sad. I understood that he did not wish to see what they would do to me. He did not wish to see his only son go up in flames.,ཁོང་གི་སྐད་སྒྲ་ནི་བཟོད་གླགས་དཀའ་བའི་སྐྱོ་གདུང་ཅན་ཞིག་རེད། ཁོང་གིས་ཁོ་ཚོས་ཅི་ཞིག་བྱེད་པར་འགྱུར་བ་མཐོང་མི་འདོད་པ་དེ་ངས་ཚོར། ཁོང་གིས་ཁོང་གི་བུ་གཅིག་པུ་དེ་མེར་སྲེག་པ་མཐོང་མི་འདོད།,0.953052,NA,https://latse.org/108-translations/#Night
"My forehead was covered with cold sweat. Still, I told him that I could not believe that human beings were being burned in our times; the world would never tolerate such crimes .. .",ངའི་དཔྲལ་བ་རྔུལ་ཆུ་གྲང་མོས་བརླན་སོང་། ཡིན་ན་ཡང་ངས་ཁོང་ལ་ཁོ་ཚོས་ངེད་གཉིས་ཀྱི་ལོ་ཚད་ཀྱི་མི་རྣམས་མེར་སྲེག་རྒྱུར་ཡིད་མི་ཆེས་པ་དང་། འགྲོ་བ་མིའི་རང་བཞིན་གྱིས་ནམ་ཡང་ལས་དེ་འདྲ་རྩོམ་བཟོད་ཡོད་མི་སྲིད་པ་ལྟ་བུ་སོགས་བརྗོད།,0.715719,NA,https://latse.org/108-translations/#Night
"“The world? The world is not interested in us. Today, everything is possible, even the crematoria ...” His voice broke.",“འགྲོ་བ་མི་ཡི་རང་བཞིན། འགྲོ་བ་མིའི་རང་བཞིན་ནི་ང་ཚོ་དང་འབྲེལ་བ་མེད། དེང་སང་ཅི་ཡང་བྱུང་ཆོག་ལ་ཅི་ཡང་འབྱུང་བར་ངེས། ཐ་ན་སྲེག་ཐབ་དེ་དག་ཀྱང་… .”,0.829986,NA,https://latse.org/108-translations/#Night
"“Father,” I said. “If that is true, then I don’t want to wait. I’ll run into the electrified barbed wire. That would be easier than a slow death in the flames.”",ཁོང་གི་རྗོད་ངག་འགག་བཞིན་འདུག,0.285413,NA,https://latse.org/108-translations/#Night
"He didn’t answer. He was weeping. His body was shaking. Everybody around us was weeping. Someone began to recite Kaddish, the prayer for the dead. I don’t know whether, during the history of the Jewish people, men have ever before recited Kaddish for themselves.",ངས། “ཨ་ཕ་ལགས། གལ་སྲིད་དེ་ལྟར་ཡིན་ན་ངས་འདིར་སྒུག་ན་མི་འདོད། ང་གློག་བཏང་ཡོད་པའི་གཟེ་མ་རྭ་མགོའི་ཐོག་ལ་མཆོངས་རྒྱུ་ཡིན། དེ་ནི་མེ་ལྕེའི་ནང་དུ་སྡུག་བསྔལ་བཟོད་ཐབས་མེད་པ་མྱོང་བ་ལས་བཟང་བར་ངེས་”ཞེས་བརྗོད། ཁོང་གིས་ལན་མ་བཏབ། ཁོང་ངུ་བཞིན་འདུག ཁོང་གི་ལུས་པོ་འདར་སིག་བྱེད་བཞིན་འདུག ང་ཚོའི་མཐའ་འཁོར་གྱི་མི་ཚང་མ་ངུ་བཞིན་འདུག མི་ཞིག་གིས་ཁ་ཌི་ཤི་སྟེ་འཆི་ཁའི་སྨོན་ལམ་འདོན་འགོ་བཙུགས། ངས་སྔོན་ཆད་ཇིའུ་ཡི་ལོ་རྒྱུས་ནང་མི་ཚོས་ཁོ་རང་ཉིད་འཆི་བ་ལ་རང་ཉིད་ཀྱིས་སྨོན་ལམ་འདེབས་པའི་དོན་དག་བྱུང་ཡོད་མེད་མ་ཤེས།,0.833417,NA,https://latse.org/108-translations/#Night
"“Yisgadal, veyiskadash, shmey raba ... May His name be celebrated and sanctified ...” whispered my father.",“ཡིད་གྷ་ཌལ་ཝེ་ཡིད་ཁ་དྷག་ཤི་མེ་ར་བྷ་ (Yitgadal veyitkadch shme raba… .) དཀོན་མཆོག་གི་ཐུགས་རྗེ་ནམ་མཁའ་དང་མཉམ་པར་ཤོག… .” ངའི་ཨ་ཕས་ལྡབ་ལྡིབ་ཀྱིས་བཟློས།,0.533004,NA,https://latse.org/108-translations/#Night
"For the first time, I felt anger rising within me. Why should I sanctify His name? The Almighty, the eternal and terrible Master of the Universe, chose to be silent. What was there to thank Him for?",ཐེངས་དང་པོར། ངའི་སེམས་ལ་དད་ལོག་གི་སེམས་སྟོབས་རྒྱས། ངས་ཅིའི་ཕྱིར་དཀོན་མཆོག་ལ་སྐྱབས་འཇུག་ཞུ་དགོས་པ་ཡིན། ཐེར་ཟུག་ཅན། འཇིག་རྟེན་གྱི་བྱེད་པོ། ནུས་མཐུའི་བདག་པོ་དང་བདུད་སྡེའི་གཉན་པོ་ཁུ་སིམ་མེར་འདུག་ན། ངས་ཅིའི་ཕྱིར་ཁོང་ལ་ཐུགས་རྗེ་ཆེ་ཞུ་དགོས་སམ།,0.958282,NA,https://latse.org/108-translations/#Night
"We continued our march. We were coming closer and closer to the pit, from which an infernal heat was rising. Twenty more steps. If I was going to kill myself, this was the time. Our column had only some fifteen steps to go. I bit my lips so that my father would not hear my teeth chattering. Ten more steps. Eight. Seven. We were walking slowly, as one follows a hearse, our own funeral procession. Only four more steps. Three. There it was now, very close to us, the pit and its flames. I gathered all that remained of my strength in order to break rank and throw myself onto the barbed wire. Deep down, I was saying good-bye to my father, to the whole universe, and, against my will, I found myself whispering the words: “Yisgadal, veyiskadash, shmey raba ... May His name be exalted and sanctified ...” My heart was about to burst. There. I was face-to-face with the Angel of Death ...",ང་ཚོ་མུ་མཐུད་ནས་མདུན་དུ་བསྐྱོད། ང་ཚོ་རིམ་གྱིས་མེ་འོབས་དེར་ཉེ་བར་གྱུར། དེ་ལས་ཚ་དམྱལ་གྱི་མེ་རླབས་ལྟ་བུ་ཞིག་འཕྱུར་བཞིན་འདུག ཡིན་ཡང་ད་དུང་དེར་གོམ་པ་ཉི་ཤུ་ཙམ་འགྲོ་དགོས། ང་ཚོའི་རུ་ཕྲེང་དེ་གོམ་པ་བཅོ་ལྔ་ལས་འགྲོ་མི་དགོས། ངའི་ཨ་ཕ་ལ་ངའི་སོའི་འཐམ་སྒྲ་ཐོས་སུ་མི་འཇུག་ཆེད་ངས་ཨམ་གཙིགས་བསྡམས། ད་དུང་ཡང་གོམ་པ་བཅུ་འདུག གོམ་པ་བརྒྱད། གོམ་པ་བདུན། ང་ཚོ་དལ་གྱིས་སྐྱོད་བཞིན་ཡོད་པ་ནི་བེམ་པོ་སྐྱེལ་འཁོར་ཞིག་གི་རྗེས་སུ་འབྲངས་ཏེ་ང་ཚོ་རང་གི་དུར་ས་ལ་སྐྱོད་བཞིན་པ་དང་ཡོངས་སུ་མཚུངས། གོམ་པ་བཞི་ལྷག་འདུག གོམ་པ་གསུམ། ད་ནི་བསླེབས་སོང་། ང་ཚོའི་རྐང་བའི་མདུན་དུ་མེ་འོབས་དང་མེ་ལྕེ་དེ་དག་ཡོད། ངས་རང་སྟེང་ན་ཡོད་པའི་སྟོབས་ཤུགས་ཡོངས་རྫོགས་གཅིག་ཏུ་བསྒྲིལ། དེ་ལྟར་བྱས་ན་ད་གཟོད་རུ་ཕྲེང་ལས་བརྒྱུགས་ཏེ་རང་ཉིད་གཟེ་མ་རྭ་མགོའི་སྟེང་ལ་འགེལ་ཐུབ་པར་འགྱུར། ངས་ང་རང་གི་སེམས་མཐིལ་ནས་ང་རང་གི་ཨ་ཕ་དང་། ཉི་ཟླ་སྐར་གསུམ་དང་བཅས་པའི་འཇིག་རྟེན་ཡོངས་ལ་གྱེས་བྲལ་ཞུས། དེའི་མཚུངས་སུ་ང་རང་ཉིད་ཇི་ལྟར་ཡིན་ཡང་ཚིག་གཅིག་རང་ཤུགས་ཀྱིས་གྲུབ་སྟེ་ངའི་མཆུ་སྒོ་ལས་ལྡབ་ལྡིབ་ཀྱིས་ཐོན། “Yitgadal veyitkadch shme raba དཀོན་མཆོག་གི་ཐུགས་རྗེ་ནམ་མཁའ་དང་མཉམ་པར་ཤོག… .” ངའི་སྙིང་འཕར་ཞིང་ལྡིང་། གནས་སྐབས་དེ་སླེབས་བྱུང་། ང་དང་འཆི་བདག་རྒད་པོ་གཉིས་གདོང་དང་གདོང་གཏད་དེ་བསྡད་ཡོད།,1.05682,NA,https://latse.org/108-translations/#Night
"No. Two steps from the pit, we were ordered to turn left and herded into barracks.",དེ་ལྟར་བྱེད་དགོས་མ་སོང་། མེ་འོབས་ལ་གོམ་པ་གཉིས་ལས་མེད་སྐབས་ང་ཚོ་གཡོན་ལ་དཀྱོགས་དགོས་པའི་བཀའ་ཕབ་ཅིང། འཕྲལ་སེལ་སྡོད་ཁང་ཞིག་གི་ནང་འགྲོ་རུ་བཅུག,0.882353,NA,https://latse.org/108-translations/#Night
I squeezed my father’s hand. He said:,ངས་ངའི་ཨ་ཕའི་ལག་པ་དམ་པོར་བསྡམས། ཁོང་ན་རེ།,1.17812,NA,https://latse.org/108-translations/#Night
"“Do you remember Mrs. Schächter, in the train?”",“ཁྱོད་ཀྱིས་མེ་འཁོར་གྱི་ནང་གི་ཨ་ལྕེ་ཤག་ཐེར་དྲན་ནམ།”,1.14259,NA,https://latse.org/108-translations/#Night
"Never shall i forget that night, the first night in camp, that turned my life into one long night seven times sealed. Never shall I forget that smoke.",ངས་དབུལ་སྒར་གྱི་མཚན་མོ་དང་པོ་དེ་ནམ་ཡང་བརྗེད་མི་སྲིད། དེས་ངའི་མི་ཚེ་འདི་མཚན་མོ་རིང་པོ་ཞིག་གི་ནང་དུ་ཁྲིད་ཅིང་། ལན་བདུན་ལ་དམོད་མོ་ཟུག་ཐེངས་བདུན་ལ་དམ་དུ་བཏགས། ངས་ནམ་ཡང་དུ་བ་དེ་བརྗེད་མི་སྲིད། ངས་ནམ་ཡང་བཞིན་རས་ཆུང་ཆུང་གི་བྱིས་པ་དེ་རྣམས་བརྗེད་མི་སྲིད། དེ་དག་གི་བེམ་པོ་རྣམས་འཇམ་ཐིང་ངེར་ཡོད་པའི་ནམ་མཁའ་རུ་དུ་བ་གོར་མོའི་རྣམ་པར་གྱུར་ཡོད།,0.282237,NA,https://latse.org/108-translations/#Night
Never shall I forget the small faces of the children whose bodies I saw transformed into smoke under a silent sky. Never shall I forget those flames that consumed my faith for ever. Never shall I forget the nocturnal silence that deprived me for all eternity of the desire to live.,ངས་ནམ་ཡང་ངའི་དད་པ་ཁྱུར་མིད་བྱེད་མཁན་གྱི་མེ་ལྕེ་དེ་དག་བརྗེད་མི་སྲིད།,0.61413,NA,https://latse.org/108-translations/#Night
Never shall I forget those moments that murdered my God and my soul and turned my dreams to ashes.,ངས་ནམ་ཡང་ང་ལས་ཐེར་ཟུག་ཅན་གྱི་དད་འདུན། གསོན་འདོད་ཀྱི་འདུན་པ་འཕྲོག་པར་བྱེད་པའི་ཁུ་སིམ་པའི་མཚན་མོ་དེ་དག་བརྗེད་མི་སྲིད། ངས་ནམ་ཡང་ངའི་དཀོན་མཆོག་དང་ངའི་བླ་སྲོག་དམར་གསོད་བྱེད་མཁན་དང་ངའི་རྨི་ལམ་དག་ཐལ་རྡུལ་དུ་བསྒྱུར་བའི་གནས་སྐབས་དེ་དག་བརྗེད་མི་སྲིད། ང་ལ་དཀོན་མཆོག་རང་ཉིད་ཀྱི་ཚེ་ཚད་དུ་གསོན་དགོས་པའི་བཀའ་ཁྲིམས་བསྒྲགས་ནའང་ངས་དོན་དག་དེ་རྣམས་བརྗེད་མི་སྲིད། དུས་གཏན་དུའོ༎,0.22341,NA,https://latse.org/108-translations/#Night
"Never shall I forget those things, even were I condemned to live as long as God Himself. Never.",ང་ཚོ་འཇུག་སའི་འཕྲལ་སེལ་གྱི་སྡོད་ཁང་དེ་ཧ་ཅང་རིང་བོ་ཞིག་རེད། དེའི་གནམ་གཅལ་དུ་ཁ་དོག་སྔོ་སྐྱ་ཅན་གྱི་སྐར་ཁུང་ཁ་ཤས་འདུག དམྱལ་ཁམས་ཀྱི་སྒུག་སྡོད་ཁང་ནི་འདི་དང་འདྲ་བར་ངེས། འདི་ན་ཇི་འདྲའི་སྨྱོན་པ་མང་པོ་ཞིག འདི་ན་ཇི་འདྲའི་ངུ་སྐད་མང་པོ་ཞིག འདི་ན་ཇི་འདྲའི་གཏུམ་སྤྱོད་མང་པོ་ཞིག,0.205831,NA,https://latse.org/108-translations/#Night
