source,target,score,source_url,target_url
"They called him Moishe the Beadle, as if his entire a Hasidic house of prayer, a shtibl. The Jews life he had never had a surname. He was the jack-of all-trades in of Sighet—the little town in Transylvania where I spent my childhood—were fond of him. He was poor and lived in utter penury. As a rule, our townspeople, while they did help the needy, did not particularly like them. Moishe the Beadle was the exception. He stayed out of people’s way. His presence bothered no one. He had mastered the art of rendering himself insignificant, invisible.",ཁོའི་མི་ཚེ་ལ་ཁོ་ལ་རུས་མིང་ཞིག་ཡོད་མ་མྱོང་བ་ལྟར་ཁོ་ཚོས་ཁོ་ལ་དཀོར་གཉེར་མོ་ཤི་ཞེས་འབོད། ཁོ་ནི་ཧ་སི་ཌིག་ཅེས་པའི་ཆོས་ཁང་གི་ལས་ཀ་ཚང་མ་བྱེད་མཁན་ཞིག་ཡིན། སི་གྷེད་(གྲོང་བརྡལ་ཆུང་ཆུང་དེ་ཋི་རན་སིལ་ཝེ་ནི་ཡ་ལ་ཡོད་ཅིང་དེར་ངའི་བྱིས་པའི་ལོ་ཟླ་བསྐྱལ་མྱོང་།) ཡི་ཇིའུ་པ་ཚོ་ཁོ་ལ་ཧ་ཅང་དུངས། ཁོ་ཧ་ཅང་དབུལ་ཞིང་གཉོམ་ཆུང་ངང་བསྡད་ཡོད། སྤྱིར་བཏང་ང་སྡོད་སའི་གྲོང་བརྡལ་གྱི་མི་ཚོས་དབུལ་བོ་ལ་རོགས་རམ་བྱེད་ན་ཡང་ཁོ་ཚོ་ལ་དམིགས་བསལ་གྱི་དགའ་ཚོར་མི་སྐྱེ། ཡིན་ན་ཡང་དཀོར་གཉེར་མོ་ཤི་ལ་དེ་ལྟར་མིན། མི་སུ་ལ་ཡང་ཁོའི་རྐྱེན་གྱིས་བག་ཟོན་གྱི་ཚོར་བ་སྐྱེས་མ་མྱོང་ལ། ཁོ་ཡོད་པ་ལ་བརྟེན་ནས་མི་སུ་ལ་ཡང་བག་མི་བདེ་བའི་ཚོར་བ་སྐྱེས་མ་མྱོང་། ཁོ་ནི་རང་ཉིད་གལ་ཆུང་དང་མངོན་མེད་དུ་སྣང་བར་བྱེད་པ་ལ་ནང་བྱན་ཆུད་པ་ཞིག་ཡིན།,0.789964,NA,https://latse.org/108-translations/#Night
"Physically, he was as awkward as a clown. His waiflike shyness made people smile. As for me, I liked his wide, dreamy eyes, gazing off into the distance. He spoke little. He sang, or rather he chanted, and the few snatches I caught here and there spoke of divine suffering, of the Shekhinah in Exile, where, according to Kabbalah, it awaits its redemption linked to that of man.",ལུས་ཁམས་ཀྱི་ཆ་ནས་ཁོ་ལ་གད་མོ་འཆོར་བའི་བཟོ་ལྟ་ཞིག་ཡོད། ཁོའི་ལུས་བོངས་ཆུང་བ་དང་འཚེར་སྣང་ཆེ་བ་དེས་མི་རྣམས་ལ་འཛུམ་མདངས་སློང་བར་བྱེད། ཁོའི་ཡིད་དུ་འོང་ཞིང་འཕྲུལ་སྣང་དང་ལྡན་པ། རྒྱང་རིང་དུ་ཅེར་ནས་སྡོད་པའི་མིག་ཟུང་གིས་བདག་གི་ཡིད་དབང་འཕྲོག ཁོ་ལ་སྨྲ་བ་ཉུང་། ཁོས་གླུ་ལེན། ངོ་མ་བཤད་ན་ཁ་ཏོན་འདོན་གི་ཡོད། ཁོས་ལེན་པའི་གླུ་ཚིག་དམ་དུམ་དེ་དག་ལས་ཕོ་རོ་ཝི་ཌེན་སིའི་ཡུལ་གྱར་དུ་གནས་པའི་དཀོན་མཆོག་གི་སྡུག་བསྔལ་ཏེ། ཁ་བྷ་ལ་ ཡི་གཞུང་ལྟར་ན་འགྲོ་བ་མི་ཡིས་མ་བསྐྱབས་བར་དུ་དཀོན་མཆོག་གི་མྱ་ངན་སངས་ཐབས་མེད་པ་དེ་ཐོས་ཐུབ།,0.517857,NA,https://latse.org/108-translations/#Night
I met him in 1941. I was almost thirteen and deeply observant. By day I studied Talmud and by night I would run to the synagogue to weep over the destruction of the Temple.,སྤྱི་ལོ་ ༡༩༤༡ ཡི་ལོ་མཇུག་ལ་ཉེ་སྐབས་ངས་ཁོ་ཤེས། དེ་དུས་ང་ལོ་བཅུ་གཉིས་ཡིན་ལ་ཆོས་དད་ལྡོག་ཏུ་མེད་པ་ཞིག་ཡོད། ཉིན་མོར་ངས་ཋལ་མུད་ལ་སློབ་སྦྱོང་བྱས་ཤིང་མཚན་མོར་ཆོས་དགོན་ལ་སོང་ནས་ཞིག་པར་གྱུར་བའི་ལྷ་ཁང་གི་ཆེད་དུ་མིག་ཆུ་གཏོར།,0.544737,NA,https://latse.org/108-translations/#Night
"One day I asked my father to find me a master who could guide me in my studies of Kabbalah.“You are too young for that. Maimonides tells us that one must be thirty before venturing into the world of mysticism, a world fraught with peril. First you must study the basic subjects, those you are able to comprehend.”",ཉིན་ཞིག་ངས་རང་གི་ཨ་ཕར་ངས་ཁ་བྷ་ལ་ལ་སློབ་སྦྱོང་བྱེད་པར་ལམ་སྟོན་དགེ་རྒན་ཞིག་འཚོལ་རོགས་ཞུས།,0.18504,NA,https://latse.org/108-translations/#Night
"My father was a cultured man, rather unsentimental. He rarely displayed his feelings, not even within his family, and was more involved with the welfare of others than with that of his own kin. The Jewish community of Sighet held him in highest esteem; his advice on public and even private matters was frequently sought. There were four of us children. Hilda, the eldest; then Bea; I was the third and the only son; Tzipora was the youngest.",“དེ་ལ་ཁྱོད་ལོ་ན་ཆུང་དྲགས་འདུག མེ་མོ་ནི་ཌེ་སི་ཡིས་ལོ་ན་སུམ་ཅུར་སོན་ན་ད་གཟོད་དཀོན་མཆོག་གི་གསང་བའི་ཡོན་ཏན་རྟོགས་རྒྱུར་འཚམ་པོ་ཡིན་ཚུལ་གསུངས་ཡོད། ཁྱོད་ཀྱིས་ཐོག་མར་ངེས་པར་དུ་རང་གི་གོ་སྟོབས་ལ་བརྟེན་ནས་སྦྱང་བྱའི་རྨང་གཞི་སྦྱོང་དགོས།” ངའི་ཨ་ཕ་ནི་སྲོལ་རྒྱུན་གྱིས་བཅིངས་ཤིང་ཚོར་བ་སྐྱེན་པོ་མེད་པའི་མི་ཞིག་ཡིན། ཐ་ན་ཁྱིམ་དུ་ཡང་སེམས་ཚོར་དགའ་སྡུག་གི་དབང་དུ་མི་འགྲོ ཁོང་ནི་རང་ཁྱིམ་ལས་གཞན་ཁྱིམ་ལ་སེམས་ཁུར་བྱེད་མཁན་ཞིག་ཡིན། སི་གྷེད་ཡི་ཇིའུ་པའི་སྤྱི་ཚོགས་ཀྱིས་ཁོང་ཧ་ཅང་མཐོ་བའི་གནས་སུ་བཀུར། ཁོ་ཚོས་ཁོང་ལ་སྤྱི་དོན་མ་ཟད་སྒེར་དོན་ཡང་གྲོས་འདྲི། ང་ཚོར་ཕྲུ་གུ་བཞི་ཡོད། དང་པོ་ཧིལ་ཌ། གཉིས་པ་བྷེ་ཡ། གསུམ་པ་བུ་གཅིག་པུ་ང་ཡིན། ཆེས་ཆུང་བའི་བྱིས་པ་ནི་བཟི་ཕོ་ར་ཡིན།,0.920207,NA,https://latse.org/108-translations/#Night
"My parents ran a store. Hilda and Bea helped with the work. As for me, my place was in the house of study, or so they said.",ངའི་ཕ་མ་གཉིས་ཀྱིས་ཚོང་ཁང་ཞིག་གཉེར་བཞིན་ཡོད། ཧིལ་ཌ་དང་བྷེ་ཡ་གཉིས་ཀྱིས་ཕ་མ་ལ་རོགས་བྱེད། ངའི་ཆ་ནས་བཤད་ན། ཁོ་ཚོས་ངའི་གནས་ནི་སློབ་གྲྭ་ཡིན་ཟེར།,0.625974,NA,https://latse.org/108-translations/#Night
"“There are no Kabbalists in Sighet,” my father would often tell me.",ངའི་ཨ་ཕས། “སི་གྷེད་ན་ཁ་བྷ་ལའི་རིང་ལུགས་པ་གཅིག་ཀྱང་མི་འདུག” ཅེས་བཟློས་ཏེ་བརྗོད།,1.21146,NA,https://latse.org/108-translations/#Night
He wanted to drive the idea of studying Kabbalah from my mind. In vain. I succeeded on my own in finding a master for myself in the person of Moishe the Beadle.,ཁོང་གིས་ངའི་འདོད་བློ་དེ་ངའི་སེམས་ནས་དབྱུང་བར་འདོད། ཡིན་ན་ཡང་ངལ་བ་འབྲས་མེད་ཡིན། ངས་ང་རང་ལ་དགེ་རྒན་ཞིག་བཙལ་ཚར། ཁོང་ནི་དཀོར་གཉེར་མོ་ཤི་ཡིན།,1.11256,NA,https://latse.org/108-translations/#Night
He had watched me one day as I prayed at dusk.,ཉིན་ཞིག་གི་ས་རུབ་ཁར་ངས་སྨོན་ལམ་འདེབས་དུས་ཁོང་གིས་ང་ལ་དོ་སྣང་གནང་འདུག,0.493971,NA,https://latse.org/108-translations/#Night
"“Why do you cry when you pray?” he asked, as though he knew me well.",ཁོང་གིས་ང་སྔོན་མ་ནས་ངོ་ཤེས་པའི་ཚུལ་གྱིས། “ཁྱོད་ཀྱིས་སྨོན་ལམ་འདེབས་སྐབས་ཅི་ལ་ངུ་བ་ཡིན།” ཞེས་ང་ལ་སྐད་ཆ་དྲིས།,1.15922,NA,https://latse.org/108-translations/#Night
"“I don’t know,” I answered, troubled.",ངས་ཧ་ཅང་ཡིད་མ་རངས་པའི་སྒོ་ནས། “ཅི་ཡིན་ངས་མི་ཤེས་”ཞེས་ལན་བཏབ།,0.911688,NA,https://latse.org/108-translations/#Night
I had never asked myself that question. I cried because . . . because something inside me felt the need to cry. That was all I knew.,དྲི་བ་དེ་ངའི་སེམས་ལ་གཏན་ནས་ཤར་མ་མྱོང་། ང་ངུ་བའི་རྒྱུ་མཚན་ནི་ངའི་སེམས་གཏིང་ན་ཅི་ཞིག་ལ་མིག་ཆུའི་དགོས་མཁོ་ཞིག་ཡོད་པ་འདྲ། ངས་ཤེས་པ་ནི་དེ་ཙམ་ཡིན།,0.583358,NA,https://latse.org/108-translations/#Night
“Why do you pray?” he asked after a moment.,ཡུད་ཙམ་ནས་ཁོང་གིས་ང་ལ། “ཁྱོད་ཀྱིས་ཅིའི་ཕྱིར་སྨོན་ལམ་འདེབས་པ་ཡིན།” ཞེས་དྲིས།,1.25238,NA,https://latse.org/108-translations/#Night
Why did I pray? Strange question. Why did I live? Why did I breathe?,ངས་ཅིའི་ཕྱིར་སྨོན་ལམ་འདེབས་པ་ཡིན། ཡ་མཚར་གྱི་དྲི་བ་ཞིག ང་ཅིའི་ཕྱིར་འཚོ་བ་ཡིན། ངས་ཅིའི་ཕྱིར་དབུགས་འབྱིན་རྔུབ་བྱེད་པ་ཡིན།,0.757331,NA,https://latse.org/108-translations/#Night
"“I don’t know,” I told him, even more troubled and ill at ease. “I don’t know.”",ངས། “ཅིའི་ཕྱིར་ཡིན་པ་ངས་མི་ཤེས།” ཞེས་ལན་བཏབ། སྔར་ལས་ཀྱང་ཡིད་མི་རངས་པ་དང་བག་མི་བདེ་བའི་ངང་ནས། “ཅིའི་ཕྱིར་ཡིན་པ་ངས་མི་ཤེས།”,0.972573,NA,https://latse.org/108-translations/#Night
"From that day on, I saw him often. He explained to me, with great emphasis, that every question possessed a power that was lost in the answer .. .",ཉིན་དེའི་རྗེས་ནས་ངས་ཁོང་རྒྱུན་དུ་མཐོང་། ཁོང་གིས་ཐག་ཆོད་པོའི་སྒོ་ནས་ང་ལ་དྲི་ལན་གྱི་ནང་དུ་མེད་པའི་སྟོབས་ཤུགས་ཤིག་དྲི་བ་རེ་རེའི་ནང་དུ་ཡོད་པའི་གསལ་འགྲེལ་བྱས།,0.468908,NA,https://latse.org/108-translations/#Night
"Man comes closer to God through the questions he asks Him, he liked to say. Therein lies true dialogue. Man asks and God replies. But we don’t understand His replies. We cannot understand them. Because they dwell in the depths of our souls and remain there until we die. The real answers, Eliezer, you will find only within yourself.",“གང་ཟག་གིས་རང་ཉིད་དཀོན་མཆོག་གི་གནས་སུ་འཕགས་པར་བྱེད་པ་ནི་ཁོས་ཁོང་ལ་བཀའ་འདྲི་ཞུས་པས་ཡིན།”ཞེས་ཁོང་བསྐྱར་ཟློས་བྱེད་པར་དགའ། “གང་ཟག་གིས་བཀའ་འདྲི་ཞུ་བ་དང་དཀོན་མཆོག་གིས་བཀའ་ལན་གནང་བ་དེ་ནི་བདེན་པའི་བཀའ་མོལ་ཡིན། ཡིན་ན་ཡང་ང་ཚོས་ཁོང་གི་བཀའ་ལན་མི་རྟོགས། ང་ཚོས་དེ་དག་རྟོགས་མི་ཐུབ། རྒྱུ་མཚན་ནི་དེ་དག་བླ་སྲོག་གི་མཐིལ་ནས་ཡོང་བ་ཡིན་ལ་མ་ཤི་བར་དུ་དེ་རྣམས་གནས། ཁྱོད་ཀྱིས་བདེན་པའི་བཀའ་ལན་རྙེད་པར་འགྱུར། ཁྱོད་ཀྱིས་རང་གི་སེམས་ཁོང་ཁོ་ན་ནས་རྙེད་པར་འགྱུར་” ཟེར།,0.982579,NA,https://latse.org/108-translations/#Night
"“And why do you pray, Moishe?” I asked him.",ངས་ཁོང་ལ། “འོ་ན་ཁྱོད་ཀྱིས་ཅིའི་ཕྱིར་སྨོན་ལམ་འདེབས་པ་ཡིན། མོ་ཤི་ལགས།” ཞེས་དྲིས།,1.55,NA,https://latse.org/108-translations/#Night
“I pray to the God within me for the strength to ask Him the real questions.”,“ངས་ངའི་སེམས་ན་བཞུགས་པའི་དཀོན་མཆོག་ཁོང་གིས་ང་ལ་ཁོང་ལ་བཀའ་འདྲི་ཡང་དག་པ་ཞུ་བའི་ནུས་པ་གནང་རྒྱུར་སྨོན་ལམ་འདེབས་པ་ཡིན།”,0.483333,NA,https://latse.org/108-translations/#Night
"We spoke that way almost every evening, remaining in the synagogue long after all the faithful had gone, sitting in the semidarkness where only a few half-burnt candles provided a flickering light.",ངེད་གཉིས་ཀྱིས་ཕལ་ཆེར་དགོང་མོ་རེ་རེར་འདི་ལྟར་གླེང་མོལ་བྱས། ངེད་གཉིས་རྒྱུན་དུ་དད་ལྡན་པ་ཚང་མ་ཆོས་ཁང་དང་བྲལ་ཤུལ་གྱི་མུན་ཁྲོད་དུ་ལུས་ཤིང་དེར་སྦར་འཕྲོ་ཅན་གྱི་ལ་སྒྲོན་རེ་འགས་ནུས་པ་ཉམས་པའི་འོད་སྣང་རེ་སྤྲོ།,0.646607,NA,https://latse.org/108-translations/#Night
"One evening, I told him how unhappy I was not to be able to find in Sighet a master to teach me the Zohar, the Kabbalistic works, the secrets of Jewish mysticism. He smiled indulgently. After a long silence, he said, “There are a thousand and one gates allowing entry into the orchard of mystical truth. Every human being has his own gate. He must not err and wish to enter the orchard through a gate other than his own. That would present a danger not only for the one entering but also for those who are already inside.”",དགོང་མོ་ཞིག་ལ་ངས་ཁོང་ལ་སི་གྷེད་ན་ང་ལ་བཟོ་ཧར་ཞེས་པ་སྟེ། ཁ་བྷ་ལ་ཆོས་ཀྱི་གླེགས་བམ། དཀོན་མཆོག་གི་གསང་བའི་ཡོན་ཏན་གྱི་དཀའ་གནད་དེ་འཁྲིད་མཁན་ཞིག་མེད་པ་དེས་ང་ཇི་འདྲ་མི་སྐྱིད་ཚུལ་བཤད། ཁོང་གིས་བག་དྲོ་བའི་འཛུམ་ཞིག་དམུལ། ཡུན་རིང་ཞིག་ལ་ཁུ་སིམ་མེར་བསྡད་རྗེས་ཁོང་ན་རེ།,0.288896,NA,https://latse.org/108-translations/#Night
"And Moishe the Beadle, the poorest of the poor of Sighet, spoke to me for hours on end about the Kabbalah’s revelations and its mysteries. Thus began my initiation. Together we would read, over and over again, the same page of the Zohar. Not to learn it by heart but to discover within the very essence of divinity.",“གསང་བའི་བདེན་པའི་ཤིང་ཏོག་གི་སྐྱེད་ཚལ་དུ་བརྟོལ་བའི་རྒྱ་སྒོ་ཆིག་སྟོང་དང་གཅིག་ཡོད། མི་རེ་རེར་རང་གི་རྒྱ་སྒོ་ཡོད། ང་ཚོ་གཏན་ནས་ནོར་མི་ཉན་པ་ཞིག་ནི་ཤིང་ཏོག་གི་སྐྱེད་ཚལ་དུ་རང་རང་གི་རྒྱ་སྒོ་མ་གཏོགས་གཞན་གྱི་རྒྱ་སྒོ་ནས་མི་འགྲོ་བ་དེ་ཡིན། གལ་ཏེ་ནོར་བ་ཡིན་ན་ནང་དུ་འཛུལ་མཁན་ཙམ་དུ་མ་ཟད། ནང་དུ་འབྱོར་ཟིན་པ་རྣམས་ལའང་ཉེན་ཁ་ཡོད།” སི་གྷེད་ཀྱི་དབུལ་བོ་རྐང་རྗེན་པ་དཀོར་གཉེར་མོ་ཤི་ཡིས་ང་ལ་དུས་ཡུན་རིང་བོར་ཁ་བྷ་ལ་ཡི་བཀྲོལ་བའི་གསང་བ་དང་མ་བཀྲོལ་བའི་གསང་བ་གསུངས། འདི་ནི་ངས་ཁོང་དང་མཉམ་དུ་ངའི་བཤུལ་ལམ་གྱི་འགོ་བཟུང་བ་ཡིན། ང་ཚོས་མཉམ་དུ་བཟོ་ཧར་ལས་ཤོག་ལྷེ་གཅིག་ཐེངས་བཅུ་ལྷག་ལ་ཀློག་དགོས་པར་འགྱུར། བློར་མ་བཟུང་ན་ཡང་དེའི་ནང་གི་ལྷ་དགོངས་ཀྱི་སྙིང་པོ་ཁོལ་དུ་ཕྱུང་།,0.620648,NA,https://latse.org/108-translations/#Night
"And in the course of those evenings I became convinced that Moishe the Beadle would help me enter eternity, into that time when question and answer would become ONE.",དགོང་མོ་དེ་དག་ལ་ངའི་སེམས་སུ་དཀོར་གཉེར་མོ་ཤི་ཡིས་ང་ཁོང་དང་མཉམ་དུ་ཐེར་ཟུག་སྟེ། དྲི་བ་དང་དྲིས་ལན་གཞི་གཅིག་ཏུ་གྲུབ་པའི་དུས་དེར་འདྲེན་པ་ལ་ཡིད་ཆེས་བརྟན་པོ་ཞིག་ཚུགས།,0.714402,NA,https://latse.org/108-translations/#Night
"And then, one day all foreign Jews were expelled from Sighet. And Moishe the Beadle was a foreigner.",དེ་ནས་ཉིན་ཞིག ཁོ་ཚོས་སི་གྷེད་ན་ཡོད་པའི་ཕྱི་རྒྱལ་ཇིའུ་པ་རྣམས་ཕྱིར་ཕུད། དཀོར་གཉེར་མོ་ཤི་ནི་ཕྱི་རྒྱལ་བ་ཞིག་ཡིན།,0.756169,NA,https://latse.org/108-translations/#Night
"Crammed into cattle cars by the Hungarian police, they cried silently. Standing on the station platform, we too were crying. The train disappeared over the horizon; all that was left was thick, dirty smoke.",ཧང་གྷ་རི་བའི་ཉེན་རྟོག་པས་ཁོ་ཚོ་དུད་འགྲོ་དབོར་འདྲེན་གྱི་མེ་འཁོར་ནང་བརྫངས། ཁོ་ཚོ་སྐྱོ་ནས་ངུས། ང་ཚོ་ཡང་མེ་འཁོར་སྒུག་སྟེགས་སུ་ངུས། མེ་འཁོར་དེ་མིག་གིས་མཐོང་ཐུབ་སའི་མཐའ་ཞིག་ནས་ཡལ་ཞིང་། དེའི་རྗེས་སུ་སྟུག་ཅིང་དྲི་ངན་པའི་དུ་བ་མ་གཏོགས་ཅི་ཡང་མཐོང་རྒྱུ་མེད་པར་གྱུར།,1.00542,NA,https://latse.org/108-translations/#Night
"Behind me, someone said, sighing, “What do you expect? That’s war ...”",ངས་ངའི་རྒྱབ་ཀྱི་ཇིའུ་པ་ཞིག་གིས་དངན་པ་རིང་བོ་ཞིག་འཐེན་པ་ཐོས།,0.7,NA,https://latse.org/108-translations/#Night
"The deportees were quickly forgotten. A few days after they left, it was rumored that they were in Galicia, working, and even that they were content with their fate.",ཁོ་ན་རེ། “ང་ཚོས་ཅི་ཞིག་རེའམ། འདི་ནི་དམག་འཁྲུག་རེད་… … .” ཅང་མ་འགོར་བར་ཕྱིར་འབུད་བྱས་པ་དག་བརྗེད་སོང་། ཁོ་ཚོ་སོང་བའི་ཉིན་ཁ་ཤས་རྗེས་མི་ཚོས་ཁོ་ཚོ་གྷ་ལི་སི་ཡ་ལ་བསླེབས་ཏེ་ལས་ཀ་ལས་པ་དང་། ཐ་ན་ཁོ་ཚོའི་འདོད་པ་ཚིམ་འདུག་ཅེས་གླེང་།,1.0236,NA,https://latse.org/108-translations/#Night
"Days went by. Then weeks and months. Life was normal again. A calm, reassuring wind blew through our homes. The shopkeepers were doing good business, the students lived among their books, and the children played in the streets.",ཉིན་ཁ་ཤས་དང་། གཟའ་འཁོར་ཁ་ཤས། ཟླ་བ་ཁ་ཤས་བཅས་འདས། མི་ཚེ་སླར་ཡང་རྒྱུན་ལྡན་དུ་གྱུར། བག་ཕེབས་ཤིང་གདེང་ཚོད་ལྡན་པའི་རླུང་བུ་ཞིག་ང་ཚོའི་ཁྱིམ་དུ་རྒྱུ། ཚོང་པ་ཚོས་ཚོང་ལེགས་པོ་རྒྱག་ཅིང་སློབ་མ་ཚོས་སེམས་རྩེ་གཅིག་གིས་སློབ་སྦྱོང་བྱེད་པ་དང་། བྱིས་པ་ཚོས་ཁྲོམ་ལམ་ན་རྩེད་མོ་རྩེ།,0.903175,NA,https://latse.org/108-translations/#Night
"One day, as I was about to enter the synagogue, I saw Moishe the Beadle sitting on a bench near the entrance.",ཉིན་ཞིག་ང་ཆོས་ཁང་དུ་འགྲོ་སྐབས། སྒོ་འགྲམ་གྱི་རྐུབ་སྟེགས་རིང་པོའི་སྟེང་དཀོར་གཉེར་མོ་ཤི་བསྡད་ཡོད་པ་མཐོང་།,1.03205,NA,https://latse.org/108-translations/#Night
