source,target,score,source_url,target_url
"“For the liberating army,” he told us. “Let them know that here lived men and not pigs.”",ཁོས་སྐད་བརྒྱབ་ནས་ན་རེ། “བཅིངས་འགྲོལ་བྱེད་པའི་དམག་མི་ལ་འདི་ལྟར་བྱེད་པ་ཡིན། འདི་ལྟར་བྱས་ན་ཁོ་ཚོས་འདིར་བསྡད་པ་མི་ཡིན་པ་མ་གཏོགས་ཕག་པ་མིན་པ་ཤེས་ཐུབ།”,0.608219,NA,https://latse.org/108-translations/#Night
So we were men after all? The block was cleaned from top to bottom.,ང་ཚོ་མི་ཡིན་ནམ། བཙོན་ཤག་གི་སྟེང་འོག་ཐམས་ཅད་དང་ཟུར་ཁུག་ཀུན་གཙང་ཕྱགས་དང་གཙང་ཁྲུས་བྱས།,0.847701,NA,https://latse.org/108-translations/#Night
At six o’clock the bell rang. The death knell. The funeral. The procession was beginning its march.,ཆུ་ཚོད་དྲུག་པར་དྲིལ་བརྡ་གྲག འཆི་བདག་གི་དུས་ཚོད་འཁོར་ལོའི་དྲིལ་བརྡ། དུར་འཇུག་གི་དྲིལ་བརྡ།,1.12857,NA,https://latse.org/108-translations/#Night
“Fall in! Quickly!”,མི་ཕྲེང་དེ་གཤར་སྐྱོད་ལ་ཉེ། “ལྔ་སྒྲིག་བྱོས། མགྱོགས་པོ་གྱིས།”,0.8,NA,https://latse.org/108-translations/#Night
"In a few moments, we stood in ranks. Block by block. Night had fallen. Everything was happening according to plan.",སྐར་ཆ་ཁ་ཤས་ནང་ང་ཚོ་བཙོན་ཤག་དང་བཙོན་ཤག་བྱས་ནས་རུ་ཕྲེང་བསྒྲིགས། མཚན་མུན་ནི་རུབ་ཚར། ཡོད་ཚད་ཚང་མ་བཏིང་ཚར་བའི་འཆར་གཞིའི་གོ་རིམ་དུ་བྱུང་།,1.22909,NA,https://latse.org/108-translations/#Night
"The searchlights came on. Hundreds of SS appeared out of the darkness, accompanied by police dogs. The snow continued to fall.",ལྟ་རྟོག་གི་གློག་བཞུ་རྣམས་བསྒྲོན། SS བརྒྱ་ཕྲག་དུ་མས་ལག་ཏུ་གོ་མཚོན་ཐོགས་ཤིང་། རོགས་སུ་ཉེན་རྟོག་པའི་ཁྱི་ཁྲིད་ནས་མུན་པའི་ནང་ནས་ཕྱིར་མངོན།,1.02638,NA,https://latse.org/108-translations/#Night
The gates of the camp opened. It seemed as though an even darker night was waiting for us on the other side.,བཙོན་སྒར་གྱི་རྒྱ་སྒོ་དག་ཕྱེ་སོང་། དེས་མཚན་གྱི་མུན་པ་འདི་ལས་ནག་པ་ཞིག་རྒྱ་སྒོའི་ཕྱི་རོལ་ན་ང་ཚོར་སྒུག་ཡོད་པ་འདྲ།,0.924545,NA,https://latse.org/108-translations/#Night
"The first blocks began to march. We waited. We had to await the exodus of the fifty-six blocks that preceded us. It was very cold. In my pocket, I had two pieces of bread. How I would have liked to eat them! But I knew I must not. Not yet.",བཙོན་ཤག་ཐོག་མ་དག་གཤར་སྐྱོད་ཀྱི་འགོ་ཚུགས། ང་ཚོས་སྒུག ང་ཚོ་ང་ཚོའི་མདུན་ན་ཡོད་པའི་བཙོན་ཤག་ལྔ་བཅུ་ང་དྲུག་པ་མ་བསྐྱོད་བར་དུ་སྒུག་དགོས། ནམ་ཟླ་ཧ་ཅང་གྲང་། ངའི་ཁུག་མའི་ནང་ན་བག་ལེབ་ཆུང་ཆུང་གཉིས་ཡོད། དེ་ཟ་ཐུབ་ཡོད་ན་ཇི་འདྲའི་སྐྱིད་པ་ལ། ཡིན་ནའང་ཟ་མི་ཆོག དེ་ཟ་བའི་དུས་ཚོད་མིན།,0.925916,NA,https://latse.org/108-translations/#Night
Our turn was coming: Block 53 ... Block 55 ...,ང་ཚོ་སྐྱོད་རེས་ལ་འབབ་པར་ཉེ། བཙོན་ཤག་ ༥༣ བཙོན་ཤག ༥༥ བ་… .,0.681579,NA,https://latse.org/108-translations/#Night
"“Block 57, forward! March!”",བཙོན་ཤག་ ༥༧ པ་སྐྱོད་འགོ་ཚུགས།,0.585333,NA,https://latse.org/108-translations/#Night
It snowed on and on.,ཁ་བ་སྙིང་རྗེ་མེད་པར་འབབ།,0.552101,NA,https://latse.org/108-translations/#Night
An icy wind was blowing violently. But we marched without faltering.,གྲང་རླུང་དྲག་ཏུ་གཡུགས། ཡིན་ཡང་ང་ཚོ་གྲང་འདར་མི་བྱེད་པར་མདུན་སྐྱོད་བྱེད།,0.657385,NA,https://latse.org/108-translations/#Night
"The SS made us increase our pace. “Faster, you tramps, you flea-ridden dogs!” Why not? Moving fast made us a little warmer. The blood flowed more readily in our veins. We had the feeling of being alive ...",SS ཚོས་ང་ཚོའི་གོམ་སྟབས་མགྱོགས་པོར་བསྐུལ། “མགྱོགས་པོ་གྱིས། ཕག་རྒན་ཁྱོད་ཚོ། འཕྱོན་མའི་བུ་ཐ་ཤལ་ཁྱོད་ཚོ།” ལོས་ཡིན་ལོས་ཡིན། མྱུར་སྐྱོད་ཀྱིས་ང་ཚོར་ལུས་དྲོད་ཅུང་ཙམ་བསླངས། ང་ཚོའི་རྩ་ལམ་གྱི་ཁྲག་ཇེ་རྒྱུགས་སུ་སོང་། རང་གིས་རང་ཉིད་སླར་གསོན་བྱུང་བ་ཚོར་… .,0.311982,NA,https://latse.org/108-translations/#Night
"“Faster, you filthy dogs!” We were no longer marching, we were running. Like automatons. The SS were running as well, weapons in hand. We looked as though we were running from them.",“མགྱོགས་པོ་གྱིས། འཕྱོན་མའི་བུ་ཐ་ཤལ་བ་ཁྱོད་ཚོ།” ང་ཚོ་ལུས་རྩོལ་གྱིས་སྐྱོད་ཀྱི་མེད་པར་འཕྲུལ་འཁོར་རང་འགུལ་བྱེད་པ་བཞིན་དུ་རྒྱུགས་ཀྱི་ཡོད། SS རྣམས་ཀྱང་རྒྱུགས་བཞིན་ཡོད་ཅིང་ཁོ་ཚོའི་ལག་ཏུ་གོ་མཚོན་ཐོགས་ཡོད། ང་ཚོ་ཁོ་ཚོའི་མདུན་དུ་འབྲོ་བ་དང་ཡོངས་སུ་མཚུངས།,0.90231,NA,https://latse.org/108-translations/#Night
"The night was pitch-black. From time to time, a shot exploded in the darkness. They had orders to shoot anyone who could not sustain the pace. Their fingers on the triggers, they did not deprive themselves of the pleasure. If one of us stopped for a second, a quick shot eliminated the filthy dog.",མུན་པ་ནི་ལ་ཆ་ལྟར་ནག མཚན་མུན་གྱི་ནང་སྐབས་སྐབས་སུ་མེ་མདའ་གྲགས། ཁོ་ཚོར་རྗེས་སུ་སྙེག་མི་ཐུབ་པ་དག་ལ་མེ་མདའ་རྒྱག་པའི་བཀའ་འཁྲོལ་ཡོད། ཁོ་ཚོའི་མཛུབ་མོ་རྣམས་མེ་མདའི་ལྡེ་ལྕགས་ཐོག་བཞག་ཡོད་ལ་ཁོ་ཚོས་ཁོ་ཚོར་འདི་ཡིས་སྐྱིད་སྣང་སྟེར། གལ་ཏེ་སུ་ཞིག་འགྲོ་མཚམས་ཆད་ན་མེ་མདའི་སྐད་དྲག་པོ་ཞིག་གྲག་པར་འགྱུར་ལ། ཡང་བསྐྱར་འཕྱོན་མའི་བུ་ཐ་ཤལ་བ་ཞིག་ཚར་བ་ཡིན།,0.910204,NA,https://latse.org/108-translations/#Night
"I was putting one foot in front of the other, like a machine. I was dragging this emaciated body that was still such a weight. If only I could have shed it! Though I tried to put it out of my mind, I couldn’t help thinking that there were two of us: my body and I. And I hated that body. I kept repeating to myself:",ངས་རང་འགུལ་འཕྲུལ་འཁོར་ཇི་བཞིན་གོམ་པ་སྤོ་བཞིན་ཡོད། ངས་རང་གི་ལྗིད་ཚད་ཅན་གྱི་གདོས་བཅས་ཀྱི་ཕུང་བོ་དྲུད་དེ་འདུར་རྒྱུགས་བྱེད་བཞིན་ཡོད། ང་ཕུང་བོ་འདི་དང་ཁ་འབྲལ་ཐུབ་ན་ལེགས་པ་ལ་ཨང་། ངས་འདི་ལྟར་མི་བསམ་པ་ལ་འབད་བརྩོན་བྱས་ནའང་། ངས་རང་ཉིད་ནི་དངོས་པོ་གཉིས་ཏེ། ཕུང་བོ་དང་ང་གཉིས་སུ་ཚོར་ཞིང་། ང་དེ་ལ་ཞེ་སྡང་སྐྱེས།,1.00578,NA,https://latse.org/108-translations/#Night
"“Don’t think, don’t stop, run!”",ངས་རང་གིས་རང་ལ། “བསམ་བློ་མ་གཏོང་། རྒྱུག་མཚམས་མ་གཅོད། རྒྱུགས་ཤིག” ཅེས་བསྐྱར་བཟླས་ཀྱིས་བརྗོད།,0.625,NA,https://latse.org/108-translations/#Night
"Near me, men were collapsing into the dirty snow. Gunshots.",ང་དང་ཐག་ཉེ་སར། མི་འགའ་མི་གཙང་བའི་ཁ་བའི་ནང་དུ་འགྱེལ་བར་གྱུར། མེ་མདས་བརྒྱབ།,1.18319,NA,https://latse.org/108-translations/#Night
"A young boy from Poland was marching beside me. His name was Zalman. He had worked in the electrical material depot in Buna. People mocked him because he was forever praying or meditating on some Talmudic question. For him, it was an escape from reality, from feeling the blows ...",ངའི་ལོགས་སུ་ཕོ་ལནད་པའི་གཞོན་ནུ་མིང་ལ་བཟལ་མན་ཟེར་བ་ཞིག་སྐྱོད་བཞིན་ཡོད། ཁོས་བྷུ་ན་ལ་གློག་ཆས་ཀྱི་དོས་ཁང་དུ་ལས་ཀ་བྱེད་མྱོང་། ཁོས་ནམ་ཡང་ཋལ་མུད་ལས་གནད་འགའ་རེ་ཁ་ཏོན་དང་བསམ་སྒོམ་བྱེད་སྟབས་ཁོ་ཚོ་ཁོ་ལ་གད་མོ་དགོད། ཁོས་དེ་ལྟར་བྱེད་པ་ནི་ཁོ་མི་ཚེ་ངོ་མ་ལས་གཡོལ་ཆེད་དང་། གཅར་རྡུང་ … མི་ཚོར་བའི་ཆེད་དུ་ཡིན།,0.904382,NA,https://latse.org/108-translations/#Night
"All of a sudden, he had terrible stomach cramps.",ཁོ་གློ་བུར་དུ་གྲོད་ཁོག་གི་ན་ཟུག་གིས་བཟུང་། ཁོས་“ངའི་གྲོད་ཁོག་ན་བྱུང་”ཞེས་ང་ལ་ཤུབ་བུར་སྨྲ། ཁོ་མུ་མཐུད་དུ་སྐྱོད་མ་ཐུབ་པས་སྐྱོད་མཚམས་གཅོད་དགོས་བྱུང་། ངས་ཁོར་ཞུ་བ་འཐེན།,0.385366,NA,https://latse.org/108-translations/#Night
"“My stomach aches,” he whispered to me. He couldn’t go on. He had to stop a moment. I begged him: “Wait a little, Zalman. Soon, we will all come to a halt. We cannot run like this to the end of the world.”",“ཅུང་ཙམ་ཞིག་སྒུག་རོགས། བཟལ་མན། ང་ཚོས་མགྱོགས་པོར་རྒྱུགས་མཚམས་འཇོག་གི་རེད། ང་ཚོ་འདི་ལྟར་འཇིག་རྟེན་གྱི་མཐའ་ལ་མ་སླེབས་བར་དུ་བརྒྱུག་གི་མ་རེད།”,0.729965,NA,https://latse.org/108-translations/#Night
"But, while running, he began to undo his buttons and yelled to me: “I can’t go on. My stomach is bursting ...”",ཡིན་ནའང་ཁོ་རྒྱུག་ཞོར་དུ་སྒྲོག་གུ་བཀྲོལ་ནས་སྨྲེ་ངག་བཏོན།,0.117241,NA,https://latse.org/108-translations/#Night
"“Make an effort, Zalman ... Try ...”",“ང་མུ་མཐུད་ནས་རྒྱུག་ཐུབ་ཀྱི་མི་འདུག ངའི་གྲོད་ཁོག་འགད་གྲབས་འདུག… .” “བཟལ་མན། སྡུག་རུས་བྱོས་… .”,0.555556,NA,https://latse.org/108-translations/#Night
"“I can’t go on,” he groaned.",“ངས་སྡུག་རུས་བྱེད་མི་… .”,0.633333,NA,https://latse.org/108-translations/#Night
He lowered his pants and fell to the ground.,ཁོའི་དོར་མ་ལུག་སོང་། ཁོས་ཁོ་རང་མར་འགྱེལ་དུ་བཅུག,0.491646,NA,https://latse.org/108-translations/#Night
That is the image I have of him.,དེ་ནི་ངའི་སེམས་ན་ཡོད་པའི་ཁོའི་གཟུགས་བརྙན་མཐའ་མ་དེ་ཡིན། ངས་ཁོ་ SS ཡིས་བསད་སོང་མི་བསམས། རྒྱུ་མཚན་ནི་མི་གཅིག་གིས་ཀྱང་དེ་འདྲ་ཤེས་ཚོར་བྱུང་མི་འདུག ཁོ་ང་ཚོའི་རྗེས་སུ་ཡོང་བཞིན་པའི་མི་སྟོང་ཕྲག་གི་གོམ་པའི་རྡོག་རྫིས་འོག་ཏུ་ཤི་བར་གྱུར་བ་ཁོ་ཐག་ཡིན།,0.193623,NA,https://latse.org/108-translations/#Night
"I don’t believe that he was finished off by an SS, for nobody had noticed. He must have died, trampled under the feet of the thousands of men who followed us. I soon forgot him. I began to think of myself again. My foot was aching, I shivered with every step. Just a few more meters and it will be over. I’ll fall. A small red flame ... A shot ... Death enveloped me, it suffocated me. It stuck to me like glue. I felt I could touch it. The idea of dying, of ceasing to be, began to fascinate me. To no longer exist. To no longer feel the excruciating pain of my foot. To no longer feel anything, neither fatigue nor cold, nothing. To break rank, to let myself slide to the side of the road ...",ངས་ཁོ་མགྱོགས་པོར་བརྗེད། ངས་ཡང་བསྐྱར་ང་རང་ཉིད་ལ་བསམ་བློ་བཏང་། ངའི་རྐང་བ་སྐྱོན་ཅན་དེའི་སྟབས་ཀྱིས་གོམ་པ་རེ་རེས་ངའི་ལུས་ཡོངས་སུ་འདར་སིག་རེ་རྒྱག ངའི་སེམས་སུ་“གཞུ་འདོམ་ཁ་ཤས། གཞུ་འདོམ་ཁ་ཤས། དེ་ནས་ངའི་ཚེ་སྲོག་གི་མཐའ་ལ་སླེབས་པར་འགྱུར། དེ་ནས་ང་འགྱེལ་བར་འགྱུར། མེ་དམར་པོ་ཞིག་འཕྲོ་བར་འགྱུར། མེ་མདའ་བརྒྱབ་པར་གྱུར།” དེ་ལྟར་ཤར། འཆི་བས་ང་ཡོངས་སུ་བཏུམས་ནས་དབུགས་ཀྱི་རྒྱུ་བའང་འགོག་སྙམ་བྱེད། འཆི་བ་ང་ལ་འཐམས་ནས་ཡོད་ཅིང་ངས་དེ་རེག་བྱ་ལྟར་དུ་ཚོར། འཆི་བའི་སེམས་ཏེ། མུ་མཐུད་ནས་འཚོ་བར་མི་འདོད་པ་དེས་ངའི་ཡིད་ཡོངས་སུ་གཡོས། སྐད་ཅིག་གི་ཡུན་ལའང་གནས་པར་མི་བྱ། བཟོད་གླགས་མེད་པའི་རྐང་བའི་ན་ཟུག་ཚོར་བར་མི་བྱ། ངལ་བ་དང་གྲང་བ་སོགས་ཅི་ཡང་ཚོར་བར་མི་བྱ། གྲལ་ཕྲེང་བཤིག་ནས་ལམ་གྱི་ལོགས་སུ་འགྲོ་བར་བྱས་ཏེ་… .,0.974825,NA,https://latse.org/108-translations/#Night
"My father’s presence was the only thing that stopped me. He was running next to me, out of breath, out of strength, desperate. I had no right to let myself die. What would he do without me? I was his sole support.",ངའི་ཨ་ཕ་གསོན་པོར་གནས་པ་དེ་ང་ … འགོག་བྱེད་ཁོ་ན་ཡིན། ཁོང་ངའི་འཁྲིས་ན་རྒྱུགས་བཞིན་ཡོད་ཅིང་དབུགས་འཚང་བཞིན་དུ་ཁོང་གི་ལུས་སྟོབས་ཀྱི་མཐའ་དང་ཁོང་གི་དྲན་ཤེས་ཀྱི་མཐར་སླེབས་ཡོད། ང་ལ་རང་སྲོག་འདོར་བའི་དབང་ཆ་མེད། ང་མེད་ན་ཁོང་གིས་ཅི་ཞིག་བྱེད་དགོས། ང་ནི་ཁོང་གི་སེམས་རྟེན་ཉག་གཅིག་ཡིན།,0.919042,NA,https://latse.org/108-translations/#Night
"These thoughts were going through my mind as I continued to run, not feeling my numb foot, not even realizing that I was still running, that I still owned a body that galloped down the road among thousands of others.",བསམ་བློ་འདི་དག་གིས་དུས་ཡུན་ཐུང་ངུ་ཞིག་བཟུང་། ཡུན་དེ་ལ་ངའི་ན་ཟུག་འཕར་ལྡབ་ཅན་གྱི་རྐང་བ་མི་ཚོར་ལ་ང་རྒྱུགས་བཞིན་པ་མི་ཚོར། རྒྱ་ལམ་སྟེང་དུ་མི་གཞན་པ་སྟོང་ཕྲག་མང་པོའི་དཀྱིལ་ན་མཆོང་རྒྱུགས་བྱེད་བཞིན་པའི་རང་གི་ཕུང་བོ་དེའང་ཚོར་མེད་ངང་རྒྱུགས་བཞིན་ཡོད།,0.99382,NA,https://latse.org/108-translations/#Night
"When I became conscious of myself again, I tried to slow my pace somewhat. But there was no way. These human waves were rolling forward and would have crushed me like an ant.",ངའི་སེམས་ཁམས་རང་སོར་འཁོར་བ་ན་ངས་གོམ་སྟབས་ཇེ་དལ་ལ་གཏོང་ཐབས་བྱས།,0.801401,NA,https://latse.org/108-translations/#Night
"By now, I moved like a sleepwalker. I sometimes closed my eyes and it was like running while asleep. Now and then, someone kicked me violently from behind and I would wake up.",ཡིན་ན་ཡང་དེ་ཡོང་མི་སྲིད་པ་ཞིག་རེད། མི་དཔུང་གི་རླབས་ཕྲེང་ཆེན་པོ་ཞིག་མདུན་དུ་སྐྱོད་བཞིན་འདུག་ལ་དེས་ང་གྲོག་མ་ཞིག་ལྟར་བརྫི་བར་འགྱུར།,0.729733,NA,https://latse.org/108-translations/#Night
"The man in back of me was screaming, “Run faster. If you don’t want to move, let us pass you.” But all I had to do was close my eyes to see a whole world pass before me, to dream of another life.",ང་གཉིད་ཀྱི་ནང་ན་རྒྱུག་བཞིན་ཡོད། གཉིད་པའི་དུས་ངའི་མིག་བཙུམས་ཡོད་ནའང་རྒྱུག་ཐུབ། སྐབས་སྐབས་སུ་ངའི་རྒྱབ་ལོགས་ཀྱི་མི་ཞིག་གིས་ང་ལ་དྲག་རྩུབ་ཀྱིས་འཕུད་རྒྱག་བྱེད། ངའི་རྒྱབ་ན་ཡོད་པའི་མི་དེས་འདི་སྐད་དུ་སྒྲོག་པར་འགྱུར། “མགྱོགས་ཙམ་རྒྱུགས། ཁྱོད་མགྱོགས་པོར་འགྲོ་མི་འདོད་ན་གཞན་པ་རྣམས་སྔོན་ལ་འགྲོ་རུ་ཆུག” ངས་བྱེད་རྒྱུ་ནི་སྐར་ཆ་ཁ་ཤས་ལ་མིག་བཙུམས་ནས་ངའི་ཕྱི་རྒྱབ་ལ་བཞག་པའི་འཇིག་རྟེན་ཧྲིལ་པོ་ཞིག་ལ་བལྟ་རྒྱུ་དང་། མི་ཚེ་གཞན་ཞིག་རྨི་ལམ་དུ་རྨི་རྒྱུ་ཁོ་ན་ཡིན།,0.580225,NA,https://latse.org/108-translations/#Night
"The road was endless. To allow oneself to be carried by the mob, to be swept away by blind fate. When the SS were tired, they were replaced. But no one replaced us. Chilled to the bone, our throats parched, famished, out of breath, we pressed on.",རྫོགས་མཐའ་མེད་པའི་རྒྱ་ལམ་ཞིག མི་ཚོགས་ཀྱིས་རྒྱབ་ནས་དེད། རང་གིས་མི་ཤེས་པའི་ལས་དབང་གིས་མདུན་ནས་འཐེན། SS རྣམས་ཐང་ཆད་ཚེ་ཁོ་ཚོ་བརྗེ་བར་འགྱུར། ཡིན་ཡང་ང་ཚོ་བརྗེ་མཁན་གཅིག་ཀྱང་མེད། རྒྱུགས་བཞིན་ཡོད་ནའང་ང་ཚོའི་ཡན་ལག་དག་གྲང་བས་སྦྲིད། ང་ཚོའི་མགྲིན་པ་ནི་སྐམ། ཕོ་བ་ནི་ལྟོགས། དབུགས་ནི་འཚང་། ང་ཚོ་མུ་མཐུད་དུ་བརྒྱུགས།,0.953858,NA,https://latse.org/108-translations/#Night
"We were the masters of nature, the masters of the world. We had transcended everything—death, fatigue, our natural needs. We were stronger than cold and hunger, stronger than the guns and the desire to die, doomed and rootless, nothing but numbers, we were the only men on earth.",ང་ཚོ་ནི་རང་བྱུང་ཁམས་ཀྱི་བདག་པོ་ཡིན། ང་ཚོ་ནི་འཇིག་རྟེན་གྱི་བདག་པོ་ཡིན། ང་ཚོ་ནི་འཆི་བ་དང་། ངལ་དུབ། ང་ཚོའི་རང་བཞིན་གྱི་དགོས་མཁོ་བཅས་ཚང་མ་ལས་བརྒལ་དགོས་ཡོད། ང་ཚོ་གྲང་ལྟོགས་ལས་སྟོབས་ཆེ་ལ། མེ་མདའ་དང་འཆི་འདོད། ཞལ་ལྕེ་དང་གོམ་བགྲོད་བཅས་ལས་ཀྱང་སྟོབས་ཆེ། ཨང་གྲངས་ཀྱི་ངོ་བོར་གྱུར་པ་ང་ཚོ་ནི་ས་ཐོག་གི་འགྲོ་བ་མི་ཁོ་ན་ཡིན།,0.852862,NA,https://latse.org/108-translations/#Night
"At last, the morning star appeared in the gray sky. A hesitant light began to hover on the horizon. We were exhausted, we had lost all strength, all illusion.",མཐའ་མར། སྐྱ་མདོག་གི་ནམ་མཁའ་ནས་ནམ་ལངས་སྐར་ཆེན་ཤར། གནམ་མཁའི་མཐའ་ནས་གཅིག་ཏུ་འདྲེས་པའི་འོད་ཕྲེང་བཏེགས། ང་ཚོ་ངལ་བས་དུབ། ང་ཚོར་སྟོབས་ཤུགས་མེད་ལ་འཁྲུལ་སྣང་ཡང་མེད།,0.814631,NA,https://latse.org/108-translations/#Night
